20211101,"COVID-19 negative certification required for entering the country.  

Residents, tourists and visitors arriving in Dubai and Abu Dhabi must have a negative COVID-19 PCR test before departure and present the certificate at check in. These need to be taken no more than 72 hours prior to departure for arrivals to Dubai and no more than 48 hours prior to departure for arrivals to Abu Dhabi. Travellers arriving in Abu Dhabi will also be required to undertake a COVID-19 PCR test on arrival. Travellers arriving in Dubai may be required to undertake a further COVID-19 PCR test on arrival and will have to isolate pending the result of the COVID-19 PCR test: <br>


","Self-isolation at own accommodation- 

Stringent entry restrictions remain in place upon arrival at all airports in the UAE which may include, but are not limited to, a Health Authority COVID-19 PCR test on arrival, mandatory quarantine period, usually via self-isolation at a private address if suitable, or a hotel or Government facility and follow up testing before you are able to complete quarantine. Once any quarantine period is complete you must continue to comply with all measures put in place by the UAE authorities to prevent the spread of COVID-19. <br>
Arrivals from countries that the UAE authorities consider high risk, and/or for whom the authorities assess private accommodation in the UAE to be unsuitable, are likely to be required to quarantine in a government quarantine facility..
","Abu Dhabi Emergency, Crisis and Disasters Committee has updated the procedure to enter Abu Dhabi emirate from within the UAE, for vaccinated citizens, residents and visitors, effective from 19 September and removed the requirement for a COVID19 PCR test. ","Latest News: 
  <br>
  <br>
International Restrictions: <br>
*Testing before arrival: COVID-19 entry requirements may change at short notice, and travellers to the UAE are strongly encouraged to check the specifics, including the time frames for undertaking COVID-19 PCR tests, before departure with their airline before they travel. Further details are available on   <a href=""https://www.emirates.com/uk/english/help/flying-to-and-from-dubai/"">Emirates</a> and  <a href=""https://www.etihad.com/en-gb/travel-updates/covid-19-uk-eu"">Etihad</a>  websites including information about what these airlines accept as proof of a negative test. 
Residents, tourists and visitors arriving in Dubai and Abu Dhabi must have a negative COVID-19 PCR test before departure and present the certificate at check in. These need to be taken no more than 72 hours prior to departure for arrivals to Dubai and no more than 48 hours prior to departure for arrivals to Abu Dhabi. Travellers arriving in Abu Dhabi will also be required to undertake a COVID-19 PCR test on arrival. Travellers arriving in Dubai may be required to undertake a further COVID-19 PCR test on arrival and will have to isolate pending the result of the COVID-19 PCR test. If you test positive for COVID-19 on arrival, depending on your symptoms and your accommodation plans, you may be required to self-isolate in a government facility, a hospital, your hotel or privately arranged accommodation for at least 10 days. <br>
If you are transiting through the UAE to a country that requires a COVID-19 PCR test on arrival, then you must obtain a negative COVID-19 PCR test before travelling. <br>
In all circumstances, the test must be a COVID-19 PCR. Other test results including antibody tests are not accepted. <br>
Further information about COVID-19 updates is available on the  <a href=""https://covid19.ncema.gov.ae/en/News/List"">UAE Coronavirus (COVID-19) Updates webpage</a> . Children under the age of 12 and those with severe and moderate disabilities will be exempted from the test requirement. Those entering the country may also be asked to take a further COVID-19 PCR test on arrival and to complete a period of self-isolation or quarantine. <br>
*Entry to Abu Dhabi:  Abu Dhabi operates a system of ‘green list’ countries, ‘non-green list’ countries and ‘travel corridors’ and different procedures will apply depending on the country that you have travelled from and your vaccination status. Quarantine and testing requirements vary and may change over time. Further information about COVID19 procedures for Abu Dhabi for vaccinated and unvaccinated travellers is available on the <a href=""https://visitabudhabi.ae/en/plan-your-trip/covid-safe-travel"">Visit Abu Dhabi website</a>. <a href=""https://www.mediaoffice.abudhabi/en/health/ad-emergency-crisis-and-disasters-committee-updates-entry-procedure-to-abudhabi-emirate-from-within-the-uae-approves-cancellation-testing/ "">Abu Dhabi Emergency, Crisis and Disasters Committee </a>  has updated the procedure to enter Abu Dhabi emirate from within the UAE, for vaccinated citizens, residents and visitors, effective from 19 September and removed the requirement for a COVID19 PCR test. The rules for entering and remaining in Abu Dhabi may change at short notice. You should check the current requirement from the <a href=""https://mediaoffice.abudhabi/en/topic/abu-dhabi-emergency-crisis-and-disasters-committee/"">Abu Dhabi Media Office website</a> and on the <a href=""https://www.wam.ae/en"">Emirates News Agency website</a>.
Visitors must register via the <a href=""https://smartservices.ica.gov.ae/echannels/web/client/guest/index.html#/registerArrivals"">ICA Smart Travel Service</a> prior to travel and take a COVID-19 PCR test up to 48 hours before they fly. Vaccination is not a condition of entry. Visitors will also need to take a PCR test upon arrival at Abu Dhabi International airport without the need to quarantine, <a href=""https://alhosnapp.ae/en/home/"">download the Al Hosn App</a> and take further PCR tests if staying in the emirate. Children under 12 years and individuals with official exemptions do not need to take a PCR test upon arrival. Further information is available on the <a href=""https://visitabudhabi.ae/en/plan-your-trip/covid-safe-travel"">Visit Abu Dhabi website</a>. <br>
Arrivals from certain countries as listed on the <a href=""https://visitabudhabi.ae/en/plan-your-trip/covid-safe-travel/permitted-countries"">Visit Abu Dhabi Green List</a> will not be required to isolate regardless of their vaccine status. The <a href=""https://www.mediaoffice.abudhabi/en/health/abudhabi-emergency-crisis-and-disasters-committee-approves-home-quarantine-in-the-emirate-without-use-of-wristbands/"">Abu Dhabi Emergency, Crisis and Disasters Committee</a> has approved home quarantine without the use of wristbands for international travellers and those in contact with positive cases with effect from 19 September 2021. Positive cases must still wear a wristband. Unvaccinated travellers, including those exempt from vaccination, arriving into Abu Dhabi from green list destinations must take a PCR test on arrival, without the need to quarantine, and take PCR tests on days 6 and 9. More information about quarantine and testing requirements for travellers to Abu Dhabi is available on the <a href=""https://u.ae/en/information-and-services/justice-safety-and-the-law/handling-the-covid-19-outbreak/travelling-amid-covid-19/quarantine-guidelines-for-travellers-to-the-uae"">UAE Government Portal</a> and <a href=""https://mediaoffice.abudhabi/health/abu-dhabi-emergency-crisis-and-disasters-committee-updates-travel-procedures-for-citizens-and-residents/"">Abu Dhabi Media Office website</a>. Further information is also available on the <a href=""https://www.etihad.com/en/travel-updates/all-destinations-travel-guides"">Etihad Airlines website</a> including a guide for arrivals in Abu Dhabi. <br>
*Dubai residents returning to or leaving Dubai:  Further information about what returning residents need to do before they travel and what will happen on arrival in Dubai including information about testing before departure, testing on arrival and quarantine is available on the <a href=""https://www.emirates.com/uk/english/help/flying-you-home/"">Emirates Airline website</a>.
*Visitors to Dubai: Further information about what visitors need to do before they travel and what will happen on arrival in Dubai including information about testing before departure, testing on arrival and quarantine is available on the <a href=""https://www.emirates.com/uk/english/help/covid-19/dubai-travel-requirements/tourists/"">Emirates Airline website</a>. Visitors must have international health insurance before travelling. All visitors to Dubai must adhere to all public health measures issued by the Dubai authorities including any requirements to quarantine. <br>
*Quarantine requirements: Stringent entry restrictions remain in place upon arrival at all airports in the UAE which may include, but are not limited to, a Health Authority COVID-19 PCR test on arrival, mandatory quarantine period, usually via self-isolation at a private address if suitable, or a hotel or Government facility and follow up testing before you are able to complete quarantine. Once any quarantine period is complete you must continue to comply with all measures put in place by the UAE authorities to prevent the spread of COVID-19. <br>
Arrivals from countries that the UAE authorities consider high risk, and/or for whom the authorities assess private accommodation in the UAE to be unsuitable, are likely to be required to quarantine in a government quarantine facility. <br>
*Cruise ships:  Passenger cruises are currently not allowed to dock in the UAE as a result of measures taken to combat COVID-19. A UAE-wide notice to mariners has issued. The Cruise Line International Association (CLIA) has adopted an <a href=""https://cruising.org/news-and-research/press-room/2020/february/clia-statement-on-2019-novel-coronavirus-outbreak"">enhanced member health policy</a> which all CLIA ocean member cruise lines are required to follow to address COVID-19. If you are planning to travel on an international cruise that is due to call at any port in the UAE, contact your travel company for the latest information. <br>
*Exit rules in response to coronavirus (COVID-19): Transit passengers from some countries are required to conduct a COVID-19 PCR test prior to departure for Dubai. The pre-travel test is also mandatory for transit passengers if their destination country requires them to do so. Further information is available on the <a href=""https://www.mediaoffice.ae/en/news/2020/October/02-10/Mohammed-bin-Rashid-directs-amendments-to-travel-protocols-in-Dubai"">Dubai Media Office website</a>. Further information is available on the <a href=""https://covid19.ncema.gov.ae/en/News/Details/1393"">National Emergency Crisis and Disasters Management Authority website</a>. Further information about testing facilities in the UAE is available on the <a href=""https://u.ae/en/information-and-services/justice-safety-and-the-law/handling-the-covid-19-outbreak/testing-for-covid-19"">UAE Government Portal</a>. 
 <br>
 <br>
 Internal Restrictions:<br>
*Travel within the United Arab Emirates: COVID-19 cases continue to be recorded in the UAE and public health measures are in place in response to the outbreak. These can vary between each Emirates and the ease of movement between regions may be affected. The local rules may change, including at short notice. You should check them carefully before you travel and whilst you are in the UAE, and ensure you comply. The UAE authorities have stated that any violation of instructions and procedures put in place to limit the spread of COVID-19 will be treated as a crime punishable by law. <br>
<a href=""https://www.mediaoffice.abudhabi/en/health/ad-emergency-crisis-and-disasters-committee-updates-entry-procedure-to-abudhabi-emirate-from-within-the-uae-approves-cancellation-testing/"">Abu Dhabi Emergency, Crisis and Disasters Committee</a> has updated the procedure to enter Abu Dhabi emirate from within the UAE, for vaccinated citizens, residents and visitors, effective from 19 September and removed the requirement for a COVID19 PCR test. 2021. The rules for entering and remaining in Abu Dhabi may change. You should check the current requirement from the <a href=""https://mediaoffice.abudhabi/en/topic/abu-dhabi-emergency-crisis-and-disasters-committee/"">Abu Dhabi Media Office website</a> and on the <a href=""https://www.wam.ae/en"">Emirates News Agency website</a>. <br>
*Public spaces and services:  Most shops, restaurants, tourist attractions and religious establishments across the UAE are open but there are restrictions and requirements in place to help contain the spread of COVID-19. Social distancing and the wearing of face masks is mandatory in most places when away from your home. This also applies to visitors staying in hotels when they are not in their room. On 22 September 2021, the UAE Ministry of Health and Prevention and the National Emergency Crisis and Disasters Management Authority announced that it is not mandatory to wear a face mask in certain places while keeping a safe physical distance of two metres. <a href=""https://www.wam.ae/en/details/1395302972580"">Click here for more information</a>. <br>
Most schools across the UAE reopened at the start of the 2021/22 academic year with a number of COVID-19 measures in place. Some schools may close or move to remote learning if there are outbreaks of COVID-19. In Abu Dhabi, students aged 16 years and above are required to be vaccinated to enter school. <br>
Abu Dhabi Emirate has made it mandatory for residents aged 16 years and above and international tourists to have a “green pass” on the “AlHosn” app in order to access public places. A green pass is acquired and maintained by full vaccination and regular negative PCR tests. Medical exemptions from vaccinations and PCR testing may apply. The AlHosn app is the UAE’s official app related to COVID-19. Further information is available on the <a href=""https://www.mediaoffice.abudhabi/health/notice-from-abudhabi-emergency-crisis-committee-on-usage-of-alhosn-app-for-green-pass/"">Abu Dhabi Media Office website</a>. <br>

 



 ","<a href=""https://www.gov.uk/foreign-travel-advice/united-arab-emirates"">Foreign travel advice, Gov.UK</a>/ 
  <a href=""https://ae.usembassy.gov/u-s-citizen-services/covid-19-information/"">US State Dept. COVID-19 Country Specific Information</a>/ 
  <a href=""https://www.osac.gov/Content/Browse/Report?subContentTypes=Alerts%2CTravel%20Advisories"">OSAC Travel Advisories</a>/
 <a href=""https://doh.gov.ae/en/covid-19"">UAE Depr of Health</a>/"
