20210305,"COVID-19 negative certification required for entering the country. 

All passengers travelling to or from Azerbaijan will require a negative COVID-19 test. The test itself can be taken more than 48 hours before your flight, but the certificate showing the negative test result will only be accepted if issued within 48 hours of the flight’s arrival time in Baku. You may be tested again for COVID-19 and have your temperature checked on arrival into Azerbaijan.
","Quarantine requirement at government designated site. 

All passengers will still need to self-isolate for 14 days. It is possible to end self-isolation if you are tested again 6 days after arrival and the result is negative. 
","<a href=""https://www.gov.uk/foreign-travel-advice/azerbaijan"">Foreign travel advice, Gov.UK</a>/ 
  <a href=""https://az.usembassy.gov/covid-19-information-for-azerbaijan/"">US State Dept. COVID-19 Country Specific Information</a>/","Latest News: Quarantine regulations extended until 1 June; public transport restrictions imposed for several periods (JAM News, 22.03.2021).
  <br>
  <br> 
 International Restrictions: <br>
 Travelling to Azerbaijan: Options for travelling to Azerbaijan are extremely limited. Check with your travel agent or call Azerbaijan Airlines. <br>
 The use of a medical mask will be required at all times whilst at the airport and on the flight. It is mandatory to keep the mask on at all times except for specific requirements for example at border control, at the request of an airport official or whilst eating. Azerbaijan’s land borders with all neighbouring countries remain closed. <br>
 *Screening: All passengers travelling to or from Azerbaijan will require a negative COVID-19 test. Negative COVID-19 test certificates required for arrival in Azerbaijan no longer need to include a QR code, which when scanned must provide details from the clinic about the test results. However, airport authorities have advised that certificates without a QR code could face additional scrutiny and passengers could be delayed in passing through immigration. The test itself can be taken more than 48 hours before your flight, but the certificate showing the negative test result will only be accepted if issued within 48 hours of the flight’s arrival time in Baku. You should seek to have your test results via email and printed off, or a paper certificate. You may be tested again for COVID-19 and have your temperature checked on arrival into Azerbaijan. You should arrange to take a private test. <br>
 Anyone who displays symptoms of COVID-19 on arrival in Azerbaijan will be directed to the medical station at the airport. From there the case will be reported to the Emergency Medical Services. <br>
 All other passengers will still need to self-isolate for 14 days. It is possible to end self-isolation if you are tested again 6 days after arrival and the result is negative. You must arrange and pay for the test yourself with a private provider. You should keep hold of any negative certificate should you be asked to provide evidence of a negative test by the authorities. Many providers offer the option to be tested at home, as you are required to self-isolate until you are re-confirmed as being COVID-19 negative you should choose this service. <br>
 Foreign citizens who do not provide a negative COVID-19 test certificate on arrival may be refused entry to Azerbaijan and returned to their country of origin at their own expense – alternatively they may be required to enter state quarantine facilities. If you are required to enter a state quarantine facility you should contact the embassy using the instructions above. <br>
 If you are arriving to Azerbaijan via a third country (i.e. not directly from the UK) you will still be required to produce a COVID-19 negative test certificate on arrival even if your airline does not request one for boarding part of your journey. <br>
 *Testing on departure: All passengers travelling to or from Azerbaijan will require a negative COVID-19 test. As of 1 March 2021 all negative COVID-19 test certificates required for arrival in Azerbaijan must include a QR code, which when scanned must provide details from the clinic about the test results. The test itself can be taken more than 48 hours before your flight, but the certificate showing the negative test result will only be accepted if issued within 48 hours of the flight’s arrival time in Baku. You should seek to have your test results via email and printed off, or a paper certificate. <br>
  <br>
  <br> 
  Internal Restrictions: <br>
 *Public places and services: The authorities have extended the ‘special quarantine regime’ in Azerbaijan to 01 April 2021. From 18 January 2021 restrictions requiring you to have an SMS message granting permission to leave residences are lifted in 5 cities and 12 districts including Baku, Sumqait and the Absheron Peninsula. A full list of areas can be found on the<a href=""https://apa.az/en/social-news/From-January-18-SMS-permission-system-to-be-canceled-in-5-cities-and-12-districts-340354"">APA news website</a>. From 25 January 2021 restrictions on travel between regions of Azerbaijan are lifted. From 25 January 2021, most businesses and services are open (with the exception of shopping malls). From 1 February 2021 restaurants and cafes are open. Local lockdowns could be applied at very short notice, you should monitor local news outlets regularly for latest updates. The wearing of masks both outdoors and indoors in public places is mandatory. Failure to wear a mask could incur a 100 AZN fine. The Baku Metro remains closed. Public transport remains closed in Baku and a number of towns and cities across Azerbaijan during weekends until at least 01 April. Schools and educational facilities have moved classes online. Extra curricula tutorial classes and training centres activites remain online only. <br> 
 *Local lockdowns: As of 14 December restrictions on movement are in force in Baku and 16 other regions. A full list of the towns and cities can be found here on the<a href=""https://apa.az/en/social-news/Movement-restriction-to-be-applied-in-Baku-and-16-cities-districts-of-Azerbaijan-337309"">APA news website</a> .
 Further local lockdowns could be applied at very short notice, you should monitor local news outlets regularly for the latest updates. <br>
 *Accommodation: Hotels are open in Azerbaijan."
