20210504,"COVID-19 negative certification required for entering the country.

On arrival in Bangladesh, all foreign nationals need to produce a medical certificate issued within 72 hours of travel indicating the passenger is COVID-19 negative. ","Self-isolation at own accommodation or government facility.

Passengers are required to complete a 14 day period of quarantine at a government facility, or government approved hotel. You may be tested for COVID-19 during this time.
<br> <br>
Bangladesh operates a number of quarantine regimes depending on where passengers are travelling from:<br>
- Passengers from, or who have visited within the previous 15 days, Argentina, Brazil, Colombia, Costa Rica, Cyprus, Georgia, India, Iran, Mongolia, Oman, South Africa and Tunisia are NOT permitted to travel to or enter Bangladesh. <br>
- Passengers arriving from many other countries, including the UK, are required to complete a 14 day period of quarantine. In most cases this will be home quarantine; however, health officials at the point of entry may determine that a government facility, or approved hotel, must be used instead<br>
- Passengers arriving from Austria, Azerbaijan, Belgium, Chile, Croatia, Estonia, France, Germany, Greece, Hungary, Iraq, Italy, Latvia, Lithuania, Netherlands, Paraguay, Peru, Slovenia, Spain, Sweden, Switzerland, Turkey and Uruguay are required to complete the 14 day period of quarantine at a government approved hotel, and must travel with confirmation of these arrangements.<br>
- Passengers arriving from Bahrain, Kuwait and Qatar are required to complete a 3 day period of quarantine at a government approved hotel, and must travel with confirmation of these arrangements, where they will be tested for COVID-19. Those testing negative for COVID-19 will be allowed to complete the remainder of a 14 day quarantine period through home quarantine. Those testing positive will be transferred to a designated government hospital where their remaining quarantine period will be assessed and determined","<a href=""https://www.gov.uk/foreign-travel-advice/bangladesh"">Foreign travel advice, Gov.UK</a>/ 
  <a href=""https://bd.usembassy.gov/covid-19-information/"">US State Dept. COVID-19 Country Specific Information</a>/
 <a href=""https://corona.gov.bd/"">COVID Country Tracker</a>/","Latest News: Countrywide lockdown extended through 16 May (OSAC, 05.05.2021). Civil aviation authority allows international flights to resume with rules for some countries vulnerable to COVID-19 (NNB, 01.05.2021). Bangladesh authorities impose ban on entry of travelers from India via land ports; air travel also suspended (Xinhua, 26.04.2021).
<br> 
<br>
International Restrictions: <br>
*Entry to Bangladesh: Bangladesh authorities have said passengers arriving from coronavirus-affected countries, should complete Health Declaration Forms and Passenger Locator Forms provided by cabin crew. You may be subjected to additional health screening measures at the airport. 
In addition to the COVID-19 test requirements for entry, the government also require passengers to carry a negative test certificate for COVID-19, issued by a <a href=""http://www.mohfw.gov.bd/index.php?option=com_docman&task=doc_download&gid=23215&lang=en"">government authorised facility</a>, on departure from Bangladesh. Airlines may have slightly different requirements and you should confirm that your test also meets the specific requirements of your airline in advance of your departure. If your journey to or from Bangladesh includes a transit stop you may need to meet separate COVID-19 certificate requirements for that country. <br>
*Medical certificate: On arrival in Bangladesh, all foreign nationals need to produce a medical certificate issued within 72 hours of travel indicating the passenger is COVID-19 negative. <br>
*Quarantine requirements: Bangladesh operates a number of quarantine regimes depending on where passengers are travelling from:<br>
- Passengers from, or who have visited within the previous 15 days, Argentina, Brazil, Colombia, Costa Rica, Cyprus, Georgia, India, Iran, Mongolia, Oman, South Africa and Tunisia are NOT permitted to travel to or enter Bangladesh. <br>
- Passengers arriving from many other countries, including the UK, are required to complete a 14 day period of quarantine. In most cases this will be home quarantine; however, health officials at the point of entry may determine that a government facility, or approved hotel, must be used instead. <br>
- Passengers arriving from Austria, Azerbaijan, Belgium, Chile, Croatia, Estonia, France, Germany, Greece, Hungary, Iraq, Italy, Latvia, Lithuania, Netherlands, Paraguay, Peru, Slovenia, Spain, Sweden, Switzerland, Turkey and Uruguay are required to complete the 14 day period of quarantine at a government approved hotel, and must travel with confirmation of these arrangements. <br>
- Passengers arriving from Bahrain, Kuwait and Qatar are required to complete a 3 day period of quarantine at a government approved hotel, and must travel with confirmation of these arrangements, where they will be tested for COVID-19. Those testing negative for COVID-19 will be allowed to complete the remainder of a 14 day quarantine period through home quarantine. Those testing positive will be transferred to a designated government hospital where their remaining quarantine period will be assessed and determined<br>
The Bangladesh authorities will retain passports of any passengers in quarantine and will return them at the end of the quarantine period. In all circumstances, people staying in a government approved hotel, government facility or hospital will need to cover the costs of those stays. You may be tested for COVID-19 during these stays. <br>
Passengers with a No Visa Required certificate (an arrangement for foreign nationals of Bangladeshi heritage) arriving in Bangladesh without a medical certificate indicating they are COVID-19 negative, or such passengers who display symptoms, will be transferred to a government facility where their quarantine period will be assessed and determined.
<br> <br> 
Internal Restrictions:<br>
*Moving around in Bangladesh: As part of COVID-19 measures, the Government of Bangladesh has introduced restrictions on movements. From 14 April until 5 May, all forms of public transport including road, rail and waterways, are suspended. Domestic air travel is operating a limited service. Further restrictions may come into force at short notice. Face masks must be worn at all times when moving in and around Bangladesh. You should also wear a mask at home if anyone in your household is displaying COVID-19 symptoms.<br>
*Curfew: The Government is requiring people to stay at home. People should only leave their homes if there is an urgent need. Anyone not complying with these requests risks legal action.<br>
*Businesses and services: Shops, including shopping malls, are operating reduced hours. Banking services are also likely to be affected. Emergency services including hospitals remain open. At short notice local authorities may lockdown buildings, streets and areas in order to control the spread of coronavirus.<br>
*Accommodation: Some hotels and guesthouses are open, but services and guest capacity are limited. In areas with high infection rates hotels and guesthouses may close completely. Check with your travel or accommodation provider.<br>







"
