20210201,"COVID-19 negative certification required for entering the country. 

All foreign arrivals, above the age of six, must have a medical certificate (PCR) showing a negative coronavirus test result, issued no later than 72 hours before entry. This requirement does not apply to holders of permanent or temporary residency in Belarus.","Self-isolation at own accommodation. 

All arrivals must self-isolate for 10 days, regardless of whether they show symptoms.","<a href=""https://www.gov.uk/foreign-travel-advice/belarus"">Foreign travel advice, Gov.UK</a>/ 
  <a href=""https://be.usembassy.gov/covid-19-information/"">US State Dept. COVID-19 Country Specific Information</a>/","Latest News: 
 <br>
 <br>
International Restrictions: <br>
 *Entry to Belarus: From midnight on 20 December, the government of Belarus will introduce additional exit controls at its land borders. No one can leave Belarus by a land border unless they have a valid exemption as set out by the Council of Ministers. Flights continue to operate in and out of Minsk National Airport as normal.<br>
 Entering Belarus through the land border is only possible for those who have temporary or permanent residency in Belarus.
 All foreign arrivals, above the age of six, must have a medical certificate (PCR) showing a negative coronavirus test result, issued no later than 72 hours before entry. This requirement does not apply to holders of permanent or temporary residency in Belarus.<br>
 All arrivals from the UK must self-isolate for 10 days, regardless of whether they show symptoms. There are different requirements in place for arrivals from other countries. You should check the specific COVID-19 test requirements set by the Belarusian authorities and your airline in advance of your flight. Different airlines have different requirements and may refuse boarding if they are not met.<br>
 You’ll need to have valid medical insurance before travelling to Belarus. You’ll be asked to provide proof of your insurance when you apply for your visa or when you arrive at Minsk airport under the visa-free regime. Contact the Embassy of the Republic of Belarus for full details of what’s required. It is still possible to enter Belarus by land, however, given the current situation, checks at the border may take longer than usual. If you are planning to enter or exit Belarus by land, we advise you to check the travel advice of the relevant neighbouring country, as coronavirus-related border restrictions may be put in place at short notice. <br>
 *Transiting: There are no separate rules for transiting Belarus, other than the requirements set out below.
 *Quarantine requirements: All arrivals from the UK must self-isolate for 10 days, regardless of whether they show symptoms. 
 There is no need to self-isolate or provide a negative coronavirus test certificate for BNs who plan to transit Belarus within 24 hours and provide evidence they will exit within this time-frame. 
  <br>
  <br> 
 Internal restrictions:<br>
  *Travel in Belarus: There are no local travel restrictions in place in Belarus. Hotels remain open and there are no restrictions in place. Shops, restaurants/cafes and manufacturing industries remain open."
