20220525,"COVID-19 negative certification required for entering the country. 

Visitors must be fully vaccinated to enter Bermuda. At least 14 days must have passed since your second dose of the vaccine and the vaccine. <br>
All visitors to Bermuda aged 2 years and over are required to have an approved Travel Authorisation to enter Bermuda. A pre-travel COVID-19 test is also required. This can either be a COVID-19 NAAT (PCR, LAMP or TMA) test up to 4 days before arrival, or a supervised antigen test up to 2 days before arrival. <br>
Children aged 2 - 11 years old do not need to be fully vaccinated but must still apply for the Bermuda COVID-19 Travel Authorisation. Children aged 2 – 11 years old who are unvaccinated must do a COVID-19 NAAT (PCR, LAMP or TMA) test up to 4 days before arrival. Children who are aged 2 – 11 years old who are fully vaccinated must do a COVID-19 NAAT (PCR, LAMP or TMA) test up to 4 days before arrival or a supervised antigen test up to 2 days before arrival. Children under 2 years do not need Travel Authorisation. <br>","Quarantine requirement at government designated site- subject to PCR and origin. <br>

All visitors aged 12 and over arriving by air or sea to Bermuda must be fully vaccinated. Unvaccinated children age 11 years and under are welcome to Bermuda with a vaccinated parent or guardian. Specific vaccine and testing requirements for travellers depends on mode of entry to Bermuda. You can find more information on travel requirements specific to you on the <a href=""https://www.gov.bm/applying-bermuda-travel-authorisation"">Government of Bermuda’s website</a>.
",All visitors arriving by air or sea to Bermuda must be fully vaccinated.  This does not apply to persons younger than 18 years and crew. ,"Latest News: 
<br> <br>
International Restrictions: <br>
*All travellers: All travellers to Bermuda aged two years old and up need approved Travel Authorisation to enter the country. From 7 March 2022, Travel Authorisation can be purchased for $40 up to a month before travel. To avoid being denied boarding, apply for your Travel Authorisation at least 24hrs before your day of departure. You can find more information on the COVID-19 Travel Authorisation on the <a href=""https://www.gov.bm/applying-bermuda-travel-authorisation"">Government of Bermuda’s website</a>.
All visitors aged 12 and over arriving by air or sea to Bermuda must be fully vaccinated. Unvaccinated children age 11 years and under are welcome to Bermuda with a vaccinated parent or guardian. Specific vaccine and testing requirements for travellers depends on mode of entry to Bermuda. You can find more information on travel requirements specific to you on the <a href=""https://www.gov.bm/applying-bermuda-travel-authorisation"">Government of Bermuda’s website</a>.
You must wear face masks when travelling to the departure airport and practice social distancing at the departure airport. <br>
Upon arrival, you must show a copy of your Travel Authorisation and present a copy of the pre-departure COVID-19 negative test result if taken to health officers on request. <br>
There are different entry requirements for returning residents and work permit holders. More information on travel requirements for residents and work permit holders can be found on the <a href=""https://www.gov.bm/coronavirus-travellers-residents"">Government of Bermuda’s website</a>.
If you’re fully vaccinated: Visitors must be fully vaccinated to enter Bermuda. At least 14 days must have passed since your second dose of the vaccine and the vaccine. <br>
All visitors to Bermuda aged 2 years and over are required to have an approved Travel Authorisation to enter Bermuda. A pre-travel COVID-19 test is also required. This can either be a COVID-19 NAAT (PCR, LAMP or TMA) test up to 4 days before arrival, or a supervised antigen test up to 2 days before arrival. No on island testing, or quarantine is required after arrival. <br> 
Find out if you qualify as fully vaccinated in Bermuda on the  <a href=""https://www.gov.bm/applying-bermuda-travel-authorisation"">Government of Bermuda’s website</a>.
Proof of vaccination status; You must present proof that you have been fully vaccinated to enter Bermuda. <br>
You cannot use the COVID Pass to demonstrate your vaccination record when entering Bermuda. You will need the Bermuda COVD-19 Travel Authorisation to prove your vaccination status. You can find more information on the COVID-19 Travel Authorisation on the  <a href=""https://www.gov.bm/applying-bermuda-travel-authorisation"">Government of Bermuda’s website</a>.
If you’re not fully vaccinated: You cannot enter Bermuda unless you are fully vaccinated. <br>
If you’ve had COVID-19 in the past year: You cannot enter Bermuda if you are aged 12 and over unless you are fully vaccinated. <br>
Children and young people: Children 12 years and over must be fully vaccinated and have an approved Travel Authorisation to enter Bermuda. A pre-travel COVID-19 test is also required. You can find more information on the COVID-19 Travel Authorisation on the <a href=""https://www.gov.bm/applying-bermuda-travel-authorisation"">Government of Bermuda’s website</a>.
Children aged 2 - 11 years old do not need to be fully vaccinated but must still apply for the Bermuda COVID-19 Travel Authorisation. Children aged 2 – 11 years old who are unvaccinated must do a COVID-19 NAAT (PCR, LAMP or TMA) test up to 4 days before arrival. Children who are aged 2 – 11 years old who are fully vaccinated must do a COVID-19 NAAT (PCR, LAMP or TMA) test up to 4 days before arrival or a supervised antigen test up to 2 days before arrival. Children under 2 years do not need Travel Authorisation. <br>
You can find more information on the requirements for children on the 
<a href=""https://www.gov.bm/applying-bermuda-travel-authorisation"">Government of Bermuda’s website</a>.
  <br>
  <br> 
 Internal Restrictions: <br>
*Accommodation: Resorts, hotels and cottages reopened at the beginning of July 2020. We recommend you check before you travel. <br>
*Public spaces and services: The following guidelines came into force on 29 November 2021: <br>
• Indoor and outdoor dining is permitted. However, restaurants, bars, night clubs, and sports or members clubs are required to limit tables to no more than ten customers. Bar service will be permitted, but customers must remain seated. No standing at the bar • Face coverings are required to be worn indoors (unless eating or drinking), and must be worn in crowded outdoor settings, as well as where a six feet physical distance cannot be maintained. • Gatherings are restricted to groups of no more than 50 people. <br>
For further information on restrictions, you should consult the <a href=""https://www.gov.bm/coronavirus-news"">Bermuda Government website</a>. You can find a full list of Bermuda’s coronavirus regulations on the <a href=""https://www.gov.bm/coronavirus-regulations"">Bermuda Government website</a>.
The <a href=""https://www.gov.bm/residents/driving-and-transportation"">Bermuda Government website</a> provides information on public transport. Non-resident visitors to Bermuda should follow local advice and guidance.
You should check the <a href=""https://www.gov.bm/coronavirus-news"">Bermuda Government website</a> for more information on what to do before travelling to Bermuda.




","<a href=""https://www.gov.uk/foreign-travel-advice/bermuda"">Foreign travel advice, Gov.UK</a>/ 
  <a href=""https://bm.usconsulate.gov/covid-19-information/"">US State Dept. COVID-19 Country Specific Information</a>/ 
  <a href=""https://www.osac.gov/Content/Report/1fd054d8-5eee-43e4-a552-1858030bd227"">OSAC Travel Advisories</a>/
 <a href=""https://www.gov.bm/coronavirus-travellers-visitors.%C2%A0"">Bermuda Government</a>/"
