20210513,"COVID-19 negative certification required for entering the country<br>

All travellers must present on arrival a valid COVID-19 PCR negative test result taken no more than 3 days in advance of your flight’s arrival. Please note that the test can be taken at any time during the day 3 days prior to the date of your arrival in Barbados. ","Quarantine requirement at government designated site.

On arrival, you will be quarantined at approved facilities (a designated holding hotel, approved villa or a government facility at your own expense).<br>
You will be required to undergo a second PCR test 5 days after arrival.For unvaccinated arrivals: on arrival, you will be quarantined at approved facilities (a designated holding hotel, approved villa or a government facility at your own expense).<br>
You will be required to undergo a second PCR test 5 days after arrival. You will need to remain in your hotel room and may be required to wear an electronic tracking bracelet until you receive the results of your second test. If the result of that second test is negative, you will not be subject to further quarantine. <br>
From 8 May a new protocol is in place for fully vaccinated individuals (2 doses administered more than 14 days prior to arrival) who have not visited India, South Africa or Brazil in the previous 21 days.

","<a href=""https://www.gov.uk/foreign-travel-advice/barbados"">Foreign travel advice, Gov.UK</a>/ 
  <a href=""https://bb.usembassy.gov/covid-19-information/"">US State Dept. COVID-19 Country Specific Information</a>/ 
  <a href=""https://www.osac.gov/Content/Browse/Report?subContentTypes=Alerts%2CTravel%20Advisories"">OSAC Travel Advisories</a>/","Latest News: Vaccinated travelers can enter country with more simplified rules starting 8 May (Travel off Path, 13.04.2021). 
<br>
<br>
International Restrictions: <br>
*Entry to Barbados: Barbados has published travel protocols setting out its entry requirements in relation to COVID-19. Visit the <a href=""https://www.visitbarbados.org/covid-19-travel-guidelines-2020"">Visit Barbados website</a> for full details. You should read these before your departure and monitor the pages on a regular basis as the requirements may change at short notice. Masks should be worn at all times during your travel to Barbados and your passage through the airport. Social distancing and hygiene protocols are in place.<br>
*Arrive with a COVID 19 negative test: All travellers must present on arrival a valid COVID-19 PCR negative test result taken no more than 3 days in advance of your flight’s arrival. Please note that the test can be taken at any time during the day 3 days prior to the date of your arrival in Barbados. (For example, if your flight arrives at 10pm on Saturday, you can take a test at any time on the Wednesday prior to this.) You should check the protocols to confirm and understand all requirements. Relevant test accrediting bodies and standards authorities include: ISO 15189, CAP, UKAS or the equivalent.<br>
All passengers are also required to submit an Embarkation/Disembarkation (ED) card 24 hours prior to travel, to which they should upload their negative test result via www.travelform.gov.bb. The BIMSafe app can also be used.<br>
If you arrive in Barbados from the UK without a valid negative PCR test, you may be denied entry to the country. You should arrange to take a private test. On arrival all passengers are also subject to a health screen.<br>
*Quarantine for unvaccinated arrivals: On arrival, you will be quarantined at approved facilities (a designated holding hotel, approved villa or a government facility at your own expense).<br>
You will be required to undergo a second PCR test 5 days after arrival. You will need to remain in your hotel room and may be required to wear an electronic tracking bracelet until you receive the results of your second test. If the result of that second test is negative, you will not be subject to further quarantine. The government aims to return results within 48 hours. Return times can sometimes be longer than this. See the <a href=""https://www.visitbarbados.org/covid-19-travel-guidelines-2020"">Barbados Travel Protocols</a> for further details.<br>
*Quarantine for vaccinated arrivals: From 8 May a new protocol is in place for fully vaccinated individuals (2 doses administered more than 14 days prior to arrival) who have not visited India, South Africa or Brazil in the previous 21 days.<br>
Details of what the Barbadian authorities will accept as proof of vaccination can be found on page 6 of the <a href=""https://www.visitbarbados.org/covid-19-travel-guidelines-2020"">Barbados Travel Protocols</a>. If you are able to provide sufficient proof that you have been vaccinated then you will be treated as if you are unvaccinated.<br>
On arrival, you will undergo a rapid PCR test either at the airport or at your government-approved accommodation. You will need to remain on the premises of your accommodation and follow the quarantine rules until you receive the results of your second test. The government aims to return results within 24 hours but it is recommended that you book two nights’ accommodation. See the <a href=""https://www.visitbarbados.org/covid-19-travel-guidelines-2020"">Barbados Travel Protocols</a> for further details.<br>
If the result of that second test is negative, you will not be subject to further quarantine. If you test positive for COVID-19 at any point during your stay in Barbados, you will be required to self-isolate. You will first be transferred to the government isolation facility for 24 hours. You can then request to self-isolate at your hotel, apartment or villa, or government approved isolation property under strict stipulations that must be signed and adhered to. This will be at your own expense for non-nationals and non-residents. You will need to remain at your designated accommodation until the Barbadian authorities are satisfied that you have recovered. This may mean a mandatory stay of several weeks in Barbados. Upon recovery, tourists can continue their holiday or return home. See the <a href=""https://www.visitbarbados.org/covid-19-travel-guidelines-2020"">Barbados Travel Protocols</a> for full details of isolation options, facilities and requirements.<br>
If you are deemed to have been in close contact with a positive COVID-19 case, you will be required to quarantine at approved facilities. See <a href=""https://www.visitbarbados.org/covid-19-travel-guidelines-2020"">Barbados Travel Protocols</a> for full details. You can find full and definitive details of the protocols at <a href=""https://www.visitbarbados.org/covid-19-travel-guidelines-2020"">Visit Barbados website</a> and are advised to read and understand the requirements carefully before departure. You should monitor the <a href=""https://www.visitbarbados.org/covid-19-travel-guidelines-2020"">Visit Barbados website</a> website on a regular basis as the Government of Barbados may change the requirements without notice.<br>


  <br> 
  <br> 
Internal Restrictions: <br>
*Travel in Barbados: Everyone should comply with the measures put in place in Barbados to limit the spread of coronavirus (COVID-19). Details of these measures can be found at the <a href=""https://gisbarbados.gov.bb/"">Barbados Government Information Service website</a> and the <a href=""https://www.visitbarbados.org/covid-19-travel-guidelines-2020"">Visit Barbados Travel Protocols</a>.<br>
All persons arriving in Barbados are required to wear face masks at all times whilst on airport grounds. Persons will also have their temperature taken. In moving around Barbados, follow social distancing protocols. Masks are mandatory in all public spaces, including out-of-doors unless you are exercising. You can expect to have your temperature taken and you may be asked to supply your contact details when entering some premises. Regular washing of hands is encouraged and you can expect to be asked to clean your hands using hand sanitizer on entering a building.(br)
You may be required to quarantine and/or undergo a further COVID-19 test at any stage of your stay if the Barbados authorities deem that you have been in close contact with a COVID-19 positive individual or mandatory monitoring highlights potential COVID-19 symptoms.<br>
You should follow the <a href=""https://www.facebook.com/gisbarbados/?tn-str=k%2AF"">Barbados Government Information Service on Facebook</a> or on their <a href=""https://gisbarbados.gov.bb/"">website</a> and monitor the <a href=""https://www.visitbarbados.org/covid-19-travel-guidelines-2020"">Barbados Travel Protocols</a> for further details as plans are subject to change at short notice. The Barbadian authorities will seek to prosecute people who breach COVID-19 protocols, including those who break quarantine protocols, which may result in a fine and/or prison sentence.(br)
The Government has announced further easing of COVID protocols. There is currently no curfew Monday to Wednesday. A curfew is however in place Thursday to Sunday nights from midnight to 5am. Beaches and parks are open daily from 5am to 7pm for recreation and exercise but picnics and parties are not allowed.<br>
*Accommodation: Not all hotels and private rentals have re-opened or fully re-opened to the public. If making a booking, you should check whether there are any coronavirus restrictions or protocols to observe.






"
