20211118,"COVID-19 negative certification required for entering the country. 

Brunei has announced that travellers to Brunei will need to provide a negative COVID-19 RT PCR test on arrival, obtained within 48 hours of travel. <br>
All foreigners must pay $350 BND for a COVID-19 test before they depart on their journey to Brunei. Travellers should carry proof of payment with them when checking in for their flight to Brunei. <br>
From 26 August 2021, all travellers must also be tested using the COVID-19 Antigen Rapid Testing (ART) at the land borders in Brunei. <br>","Quarantine requirement at government designated site. 

You will need to go into quarantine on arrival at a government designated facility (usually a local hotel). Travellers are responsible for booking directly with hoteliers and must secure your accommodation before arrival and have proof of their stay to show the airline at check-in. <br>
Travellers who have completed their second dose of the COVID-19 vaccination will only be required to quarantine between 1 to 7 days, depending on the country they departed from. Their second dose of the vaccine must be obtained more than 14 days from the date of arrival into Brunei. Travellers are required to upload the status and proof of vaccination when applying for a travel permit. <br>
Travellers who are unvaccinated, or have not completed their second dose of the COVID-19 vaccination, or those who obtained their second dose less than 14 days from the date of arrival, will be required to quarantine between 2 and 14 days, from the first full day after arrival. Travellers will be informed of the duration of quarantine on arrival and will need to cover the cost of their stay in their designated quarantine facility. <br>","<a href=""https://www.gov.uk/foreign-travel-advice/brunei"">Foreign travel advice, Gov.UK</a>/ 
 <a href=""https://bn.usembassy.gov/u-s-citizen-services-covid-19-information/"">US State Dept. COVID-19 Country Specific Information</a>/
 <a href=""http://www.moh.gov.bn/SitePages/COVID-19.aspx"">Ministry of Health</a>/","Latest News: 
 <br>
 <br>
International Resrictions:<br>
*Entry to Brunei: Entry to Brunei is severely restricted. Anyone seeking to enter Brunei must apply for a permit from the Prime Minister’s Office at least 8 working days before the intended date of travel. <a href=""http://www.pmo.gov.bn/travelportal/Home.aspx"">See the Brunei Prime Minister’s Office website</a> for further information, or <a href=""http://www.mfa.gov.bn/uk-london/SitePages/Home.aspx"">contact the Brunei High Commission</a>. <br>
Brunei has announced that travellers to Brunei will need to provide a negative COVID-19 RT PCR test on arrival, obtained within 48 hours of travel. You should arrange to take a private test. <br>
Travellers who have successfully received a permit from the Prime Minister’s Office may enter by air or land ports. Entry through seaports is not permitted. <br>
From 1 October 2020, all travellers entering Brunei via a land border will need to pay $3 BND per person on exit and $3 BND on return or entry. You should refer to the <ahref=""http://www.pmo.gov.bn/Theme/Home.aspx"">Prime Minister’s Office website</a> for the latest information. <br>
*Demonstrating your COVID-19 status: Brunei will accept the proof of COVID-19 recovery and vaccination record. Your  appointment card from vaccination centres is not designed to be used as proof of vaccination and should not be used to demonstrate your vaccine status. <br>
*Quarantine requirements: If the government of Brunei permits you entry, you will need to go into quarantine on arrival at a government designated facility (usually a local hotel). Travellers are responsible for booking directly with hoteliers and must secure your accommodation before arrival and have proof of their stay to show the airline at check-in. <br>
Travellers who have completed their second dose of the COVID-19 vaccination will only be required to quarantine between 1 to 7 days, depending on the country they departed from. Their second dose of the vaccine must be obtained more than 14 days from the date of arrival into Brunei. Travellers are required to upload the status and proof of vaccination when applying for a travel permit. <br>
Travellers who are unvaccinated, or have not completed their second dose of the COVID-19 vaccination, or those who obtained their second dose less than 14 days from the date of arrival, will be required to quarantine between 2 and 14 days, from the first full day after arrival. Travellers will be informed of the duration of quarantine on arrival and will need to cover the cost of their stay in their designated quarantine facility. <br>
You should make sure that you have the means to pay for your hotel in Brunei for the duration of your quarantine period.<br>
Testing/screening on arrival: Brunei has announced that travellers to Brunei will need to provide a negative COVID-19 RT PCR test on arrival, obtained within 48 hours of travel. <br>
All foreigners must pay $350 BND for a COVID-19 test before they depart on their journey to Brunei. Travellers should carry proof of payment with them when checking in for their flight to Brunei. <br>
From 26 August 2021, all travellers must also be tested using the COVID-19 Antigen Rapid Testing (ART) at the land borders in Brunei. Immigration Control Posts at Brunei’s land borders are operating shortened hours from 6am and last call at 4pm. There are health and temperature screening measures at borders. You should comply with any additional screening measures put in place by the local authorities. <br>
*Data collection: On arrival in Brunei, it is mandatory to use the <a href=""http://www.moh.gov.bn/SitePages/bruhealth.aspx"">BruHealth app</a>. Failure to do so may result in financial penalties and legal repercussions, additionally you not being able to access public buildings. <br>
  <br>
  <br> 
Internal Restrictions: <br>
*Coronavirus lockdown: Brunei has been in lockdown since 7 August 2021 with a daily curfew between 8pm and 4am. This will be shortened to 10pm and 4am from Friday 19 November. You will need to <a href=""http://www.pmo.gov.bn/Theme/Home.aspx"">apply for a special authorisation letter  </a> from the Prime Minister’s Office to leave home during this time. <br>
The Ministry of Health announced a de-escalation plan as part of its National COVID-19 Recovery Framework. Effective from Friday, 19 November 2021, places of worship and commercial premises (including restaurants, cafes and sports facilities) will be partially reopened. Higher education institutions are allowed to open to fully vaccinated students and school staff. School for Primary and Secondary levels will be conducted online during this de-escalation period. Mass gathering of up to 200 people or 50 percent capacity (whichever is lower) is allowed with strict COVID-19 regulations in place. Families of up to 30 people can hold gatherings at home. <br>
Only fully vaccinated members of the public will be allowed to gather as a family, and enter public premises and government offices. Brunei will accept the proof of COVID-19 recovery and vaccination record. Your appointment card from vaccination centres is not designed to be used as proof of vaccination and should not be used to demonstrate your vaccine status. <br>
You should expect to have your temperature taken, electronically, and must check-in to business premises and government offices using the <a href=""http://www.moh.gov.bn/SitePages/bruhealth.aspx""> BruHealth app</a>. <br>
Masks are mandatory for everyone over 2 years old when in public places, but may be removed when you are drinking or eating, or if you are alone. There are financial penalties for not adhering to masks guidelines. <br>
Before travelling  you should check the <a href=""http://www.moh.gov.bn/SitePages/COVID-19.aspx"">Brunei Ministry of Health</a> and the <a href=""http://www.pmo.gov.bn/Theme/Home.aspx"">Prime Ministers Office</a> websites for up to date guidance, policy on travel to/from Brunei and details on how to download and use the <a href=""http://www.moh.gov.bn/SitePages/bruhealth.aspx"">BruHealth app</a>.
*If you test positive for COVID-19, you may need to stay where you are until you test negative. You may also need to seek treatment there.
"
