20220727,"COVID-19 negative certification required for entering the country. 
Travellers will no longer need a negative pre-departure COVID-19 test to enter Brunei. <br>
 Travellers who are not fully-vaccinated are only permitted to enter Brunei if they can verify that they are medically exempted from receiving a COVID-19 vaccination. They are required to take an ART at home on the day of their arrival (Day 1) and a RT-PCR test on Day 3 at an accredited private clinic.<br>","Quarantine requirement at government designated site. 
 Travellers who are not fully-vaccinated are only permitted to enter Brunei if they can verify that they are medically exempted from receiving a COVID-19 vaccination. They are required to undergo self-isolation for three days and until a negative RT-PCR result is obtained.  <br>","To enter Brunei via air travel, a traveller is considered fully vaccinated if they have received two doses of a vaccine that has received WHO emergency use listing (or one dose for Johnson & Johnson)","Latest News: 
 <br>
 <br>
International Resrictions:<br>
*All travellers: Land and sea borders are currently closed (see Land and sea travel below). Brunei only allows inbound travel by fully vaccinated passengers (see Demonstrating your COVID-19 status below for definition of fully vaccinated). <br>
All travellers into Brunei must; <br>
•        be fully vaccinated with two doses unless they can show proof of a medical exemption from having the COVID-19 vaccination (under 18s travelling with a group of all vaccinated adults will follow the vaccinated protocols). Please see “Demonstrating your COVID-19 status” below for new definition after 31 October 2022. <br>
submit an E-Health Arrival Declaration form on the <a href=""http://www.pmo.gov.bn/travelportal"">PMO travel portal</a> no more than 24 hours prior to departure. <br>
•        If unvaccinated, make payment for the relevant post arrival COVID-19 tests depending on your vaccination or recovery status and obtain a payment receipt which states the name and passport number of the traveller <br>
Travellers will no longer need a negative pre-departure COVID-19 test to enter Brunei. <br>
Foreign nationals entering Brunei for a short visit (less than 90 days) are required to obtain Travel Insurance with COVID-19 medical coverage (a minimum of $20,000 BND). Foreign nationals entering for the purpose of employment, studying or as eligible dependent are exempted from this requirement. You should refer to the <a href=""http://www.pmo.gov.bn/Theme/Home.aspx"">Prime Minister’s Office website  </a>
for the latest information. <br>
*If you’re fully-vaccinated: From 15 June 2022, a fully vaccinated traveller is no longer required to obtain a pre-departure swab test (RT-PCR or an Antigen Rapid Test (ART)) and is no longer required to undergo ART testing and self-isolate upon arrival.<br>
*Demonstrating your COVID-19 status: To enter Brunei via air travel, a traveller is considered fully vaccinated if they have received two doses of a vaccine that has received WHO emergency use listing (or one dose for Johnson & Johnson). From 1 November 2022 a traveller will only be considered fully vaccinated if they have had a booster shot or received their second dose not more than three (3) months prior. Travellers who are not fully-vaccinated are only permitted to enter Brunei if they can verify that they are medically exempted from receiving a COVID-19 vaccination. <br>
For land or sea travel, a foreign national is considered fully vaccinated if they have received two doses of a vaccine that has received WHO emergency use listing (or one dose of Johnson & Johnson). Citizens and residents of Brunei are considered fully vaccinated if they have received three doses of a vaccine that has received WHO emergency use listing or received their second dose not more than three months prior to departure. <br>
Brunei will accept the proof of COVID-19 recovery and vaccination record. Your appointment card from vaccination centres is not designed to be used as proof of vaccination and should not be used to demonstrate your vaccine status. <br>
*If you’re not fully vaccinated: Travellers who are not fully-vaccinated are only permitted to enter Brunei if they can verify that they are medically exempted from receiving a COVID-19 vaccination. They are required to take an ART at home on the day of their arrival (Day 1) and a RT-PCR test on Day 3 at an accredited private clinic. They are also required to undergo self-isolation for three days and until a negative RT-PCR result is obtained. Travellers will be charged $100 BND before travelling for both ART and RT-PCR. COVID-19 recovered travellers are only required to perform the ART upon arrival and are exempted from the mandatory self-isolation. <br>
Travellers who have recently had COVID: Travellers who have recovered from COVID-19 in the past 90 days do not have to take a pre-travel COVID-19 test and will only have to take one ART on arrival at home or their hotel. They must have a certificate as proof of recovery from COVID-19 in the past 90 days. Travellers who have recovered from COVID-19 in the past 90 days will be exempted from undergoing mandatory self-isolation. <br>
Data collection: The <a href=""http://www.moh.gov.bn/SitePages/bruhealth.aspx"">BruHealth app</a> may still be used in Brunei to enter public buildings and events where you need to scan a QR code. For unvaccinated travellers, you may still need to use the app to record test results, record your health status on a daily basis and receive your Day 3 RT-PCR swab test results. <br>
*Exemptions: Exceptions will be considered by the Prime Minister’s Office on a case-by-case basis. You should refer to the <a href=""http://www.pmo.gov.bn/Theme/Home.aspx"">Prime Minister’s Office website  </a> for the latest information and their contact details.
  <br>
  <br> 
Internal Restrictions: <br>
*Coronavirus lockdown: As part of Brunei’s National COVID-19 Recovery Framework, Brunei ended its “early endemic phase” on 31 May 2022. Business premises, including restaurants, fitness facilities, markets and cinemas are open. Since 1 June 2022, there is no longer a limitation on the capacity of mass gatherings (at home or in public). All sporting activities are allowed without limitations. <br>
All child care centres, kindergartens, primary and secondary schools, colleges and sixth form centres are open for in person classes Students must take an Antigen Rapid Test (ART)three times a week. <br>
All individuals, regardless of vaccination status are now allowed to enter public premises and government offices and attend private and public events.<br>
Brunei will accept the proof of COVID-19 recovery and vaccination record. Your appointment card from vaccination centres is not designed to be used as proof of vaccination and should not be used to demonstrate your vaccine status. <br>
From 15 June, temperature check and scanning your BruHealth app before entering premises will no longer be required but private businesses may still require you to do so. <br>
Masks are mandatory for everyone over 2 years old when in public places indoors, but may be removed when you are drinking or eating. There are financial penalties for not adhering to mask guidelines. Masks are not mandatory outdoors but are recommended in crowded areas.<br>
Foreign people travelling should check the <a href=""http://www.moh.gov.bn/SitePages/COVID-19.aspx"">Brunei Ministry of Health</a>and the <a href=""http://www.pmo.gov.bn/Theme/Home.aspx"">Prime Ministers Office  </a>
websites for up to date guidance, policy on travel to/from Brunei and details on how to download and use the <a href=""http://www.moh.gov.bn/SitePages/bruhealth.aspx"">BruHealth app</a>
*If you test positive for COVID-19, you may need to stay where you are until you test negative. You may also need to seek treatment there.



","<a href=""https://www.gov.uk/foreign-travel-advice/brunei"">Foreign travel advice, Gov.UK</a>/ 
 <a href=""https://bn.usembassy.gov/u-s-citizen-services-covid-19-information/"">US State Dept. COVID-19 Country Specific Information</a>/
 <a href=""http://www.moh.gov.bn/SitePages/COVID-19.aspx"">Ministry of Health</a>/"
