20211103,"COVID-19 negative certification required for entering the country. <br>
Travellers who are not fully vaccinated or unable to prove that they have recovered from COVID-19 in the last 6 months will have to present proof of a negative PCR test (max. 72 hours old) or rapid antigen test (max. 48 hours old) in the following cases: if they are entering Switzerland by airplane; if they have been, within the last 10 days before entering Switzerland, in a <a href=""https://www.bag.admin.ch/bag/en/home/krankheiten/ausbrueche-epidemien-pandemien/aktuelle-ausbrueche-epidemien/novel-cov/empfehlungen-fuer-reisende/liste.html"">country with a variant of concern</a>.<br>
- Entry from non high-risk countries. In the following cases, travellers are not subject to any restriction: full vaccination against COVID-19, with the last dose taken no earlier than 6 months ago; recovery from COVID-19 within 6 months from the end of the isolation period. Travellers arriving by air are always subject to the requirement for a pre-departure negative PCR test taken within 72 hours prior to arrival (rapid antigen tests are not accepted). Children under 16 years old are exempted.<br> 
- Entry from high-risk countries. In the following cases, travellers are not subject to any restriction: full vaccination against COVID-19, with the last dose taken no earlier than 6 months ago; recovery from COVID-19 within 6 months from the end of the isolation period. The other travellers who, in the last 10 days, have stayed in a country with an increased risk of infection, are subject to the requirement for a pre-departure negative PCR test taken within 72 hours prior to arrival. Children under 16 years old are exempted. Additionally, they must complete a mandatory quarantine and report their arrival in Switzerland to the cantonal authorities. The quarantine can be shortened with a negative result to a PCR test taken on day 7.<br>
- Entry from countries with a variant of concern: All travellers who, in the last 10 days, have stayed in a country with an area of concern, are subject to the requirement for a pre-departure negative PCR test taken within 72 hours prior to arrival. Children under 12 years old are exempted. Additionally, they must complete a mandatory quarantine and report their arrival in Switzerland to the cantonal authorities. The quarantine can be shortened with a negative result to a PCR test taken on day 7. COVID-19 vaccination does not exempt from the mandatory quarantine requirement. Travellers from countries with a variant of concern are always subject to the <a href=""https://swissplf.admin.ch/"">entry form</a>  requirement (even if they are vaccinated or recovered from COVID-19). The entry form must also be filled out for children (who can be included on the form of an adult travelling with them).<br> 
If you are not vaccinated or recovered from COVID-19, you must complete an <a href=""https://swissplf.admin.ch/"">entry form</a> in the following cases:
•        You are entering Switzerland by rail, bus or coach, boat or air, including stopover and transit;<br>
•        You have stayed in a country with an increased risk of infection in the 10 days before entering Switzerland.<br>

  
","Self-isolation at own accommodation- subject to ctegory.<br>
The Federal Office of Public Health provides a regularly updated list of <a href=""https://www.bag.admin.ch/bag/en/home/krankheiten/ausbrueche-epidemien-pandemien/aktuelle-ausbrueche-epidemien/novel-cov/empfehlungen-fuer-reisende/liste.html#858610174"">countries defined as COVID-19 risk area</a>, so called countries or areas with variants of concern. Entry from such countries is possible. Travellers who are not fully vaccinated or unable to prove that they have recovered from COVID-19 within the last 6 months will have to present proof of a negative PCR test (max. 72 hours old) or rapid antigen test (max. 48 hours old) upon entry. After four to seven days in Switzerland, another test must be carried out, subject to a fee. The result of the second test as well as the entry form number must be submitted to the <a href=""https://www.bag.admin.ch/bag/en/home/krankheiten/ausbrueche-epidemien-pandemien/aktuelle-ausbrueche-epidemien/novel-cov/empfehlungen-fuer-reisende/quarantaene-einreisende.html#-1675462321"">relevant cantonal office</a>. Additionally, travellers from a <a href=""https://www.bag.admin.ch/bag/en/home/krankheiten/ausbrueche-epidemien-pandemien/aktuelle-ausbrueche-epidemien/novel-cov/empfehlungen-fuer-reisende/liste.html"">country with a variant of concern</a> that have not been vaccinated according to the requirements of the Swiss authorities or are unable to prove that they have recovered from COVID-19 within the last 6 months must go into quarantine after entering Switzerland. <br>
The quarantine requirement also applies to children – even if the parents are fully vaccinated. There is the possibility of shortening travel quarantine from day 7 onwards.
","The EU Digital COVID Certificate (available as of 1 July 2021) provides proof that a person has either: <br>
Persons who have been vaccinated are persons who have received a vaccine that: <br>
is authorised in Switzerland and which has been administered in full in accordance with the recommendations of the Federal Office of Public Health of Switzerland;
has been authorised by the European Medicines Agency for the European Union and has been administered in full in accordance with the requirements or recommendations of the country in which the vaccination was administered; or<br>
is authorised under the WHO Emergency Use Listing and has been administered in full in accordance with the requirements or recommendations of the country in which the vaccination was administered.<br>
The vaccination is regarded as being effective for 12 months from the date on which it was administered in full; the Janssen vaccine is regarded as being effective for 12 months from the 22nd day after it was administered in full.<br>
Proof of vaccination may be provided in the form that is customary at the time. In addition to the surname, forename and date of birth of the person concerned, it must include the following information: the date of vaccination; the vaccine used; been vaccinated against COVID-19 (vaccine type and manufacturer, number of doses, date of vaccination);<br>
received a negative test result, PCR or rapid antigen, with the name of the test, date and time of test, test centre and result (self-tests are not valid);<br>
recovered from COVID-19 (positive PCR test result valid for 180 days).<br>
When travelling, holders of the EU Digital COVID Certificate will have the same rights as citizens of the visited Member State who have been vaccinated, tested or recovered.<br><br>
Rules to enter this country from an EU Member State or Schengen Associated country: If you are not vaccinated or recovered from COVID-19, you must complete an <a href=""https://swissplf.admin.ch/"">entry form</a> in the following cases:<br>
•        You are entering Switzerland by rail, bus or coach, boat or air. This also includes a stopover in Switzerland, for example air travellers who have to change flight; <br>
•        You have stayed in a country with an increased risk of infection in the 10 days before entering Switzerland.<br>
Travellers from countries with a variant of concern are always subject to the entry form requirement (even if they are vaccinated or recovered from COVID-19).<br>
The entry form must also be filled out for children (who can be included on the form of an adult travelling with them).<br>
Rules to enter this country from outside an EU Member State or Schengen Associated country: <br>
Travellers do NOT have to fill out the pre-travel clearance form if they are entering from states or areas of low epidemiological risk, carry proof of vaccination, recovery or a negative test result according to the below requirements, and have not stayed in any other state or area than those of low epidemiological risk or Austria in the past 10 days. <br>
Travellers DO have to fill out the <a href=""https://www.oesterreich.gv.at/en/themen/coronavirus_in_oesterreich/pre-travel-clearance.html"">pre-travel clearance form</a> if they cannot provide such proof or have stayed in a state or area other than those of low epidemiological risk or Austria in the past 10 days.<br>


","Latest News: Swiss government bans flights from several African countries (Reuters, 26.11.2021)
 <br>
  <br>
International Restrictions: <br>
*From within the EU: <p>Entry into Switzerland is also possible without a EU Digital COVID Certificates’ (EUDCC). For respective travellers, a negative test, a proof of vaccination or a proof of recovery from COVID-19 is required and the contact details have to be provided. The following should be noted:</p><p>&nbsp;</p><p><b>Test requirement</b></p><p>Travellers who are not fully vaccinated or unable to prove that they have recovered from COVID-19 in the last 6 months will have to present proof of a negative PCR test (max. 72 hours old) or rapid antigen test (max. 48 hours old) upon entry. After four to seven days in the country, another test must be carried out, subject to a fee. The result of the second test as well as the entry form number must be submitted to the <a href=""https://www.bag.admin.ch/bag/en/home/krankheiten/ausbrueche-epidemien-pandemien/aktuelle-ausbrueche-epidemien/novel-cov/empfehlungen-fuer-reisende/quarantaene-einreisende.html#-1675462321"" target=""_blank"">relevant cantonal office</a>. The test result needs to be submitted in the form of a COVID test certificate in accordance with the <a href=""https://www.fedlex.admin.ch/eli/cc/2021/325/en"" target=""_blank"">Covid-19 Regulation Certificates of 4th June 2021</a>.</p><p>Children under the age of 16 are never required to provide proof of a negative coronavirus test on entering Switzerland.</p><p>&nbsp;</p><p><b>Proof of vaccination</b></p><p>To be considered as fully vaccinated, people have to be vaccinated with a vaccine that:</p><ol><li>is <b>authorised in Switzerland</b> and which has been administered in full in accordance with the recommendations of the Federal Office of Public Health of Switzerland;</li><li>has been <b>authorised by the European Medicines Agency</b> for the European Union and has been administered in full in accordance with the requirements or recommendations of the country in which the vaccination was administered;</li><li>is <b>authorised under the WHO Emergency Use Listing</b> and has been administered in full in accordance with the requirements or recommendations of the country in which the vaccination was administered;</li><li>has been shown to have the same composition as a vaccine licensed under subparagraph (a), (b) or (c) but marketed by a licensee under a different name and which has been administered in full in accordance with the requirements or recommendations of the country in which the vaccination was administered</li></ol><p>The vaccination is regarded as being effective for 12 months from the date on which it was administered in full; one dosis vaccines are regarded as being effective for 12 months from the 22nd day after they were administered in full.</p><p>Proof of vaccination may be provided in the form that is customary at the time. In addition to the surname, forename and date of birth of the person concerned, it must include the following information:</p><ul><li>the date of vaccination;</li><li>the vaccine used.</li></ul><p>&nbsp;</p><p><b>Proof of recovery</b></p><p>Proof of recovery remains valid for 6 months from the 11th day following the confirmation of the infection.</p><p>Proof of recovery may be provided in the form that is customary at the time. In addition to the surname, forename and date of birth of the person concerned, it must include the following information:</p><ul><li>confirmation of the infection including the name and address of the confirming body (test centre, doctor, pharmacy, hospital);</li><li>confirmation that isolation has been terminated or confirmation of recovery from a doctor.</li></ul><p>&nbsp;</p><p><b>Entry from a country or area defined as COVID-19 risk area</b></p><p><b>Quarantine requirement</b></p><p>The Federal Office of Public Health provides a regularly updated list of <a href=""https://www.bag.admin.ch/bag/en/home/krankheiten/ausbrueche-epidemien-pandemien/aktuelle-ausbrueche-epidemien/novel-cov/empfehlungen-fuer-reisende/liste.html#858610174"" target=""_blank"">countries defined as COVID-19 risk area</a>, so called countries or areas with variants of concern. Entry from such countries is possible. Travellers who are not fully vaccinated or unable to prove that they have recovered from COVID-19 within the last 6 months will have to present proof of a negative PCR test (max. 72 hours old) or rapid antigen test (max. 48 hours old) upon entry. After four to seven days in Switzerland, another test must be carried out, subject to a fee. The result of the second test as well as the entry form number must be submitted to the relevant <a href=""https://www.bag.admin.ch/bag/en/home/krankheiten/ausbrueche-epidemien-pandemien/aktuelle-ausbrueche-epidemien/novel-cov/empfehlungen-fuer-reisende/quarantaene-einreisende.html#-1675462321"" target=""_blank"">cantonal office</a>. Additionally, travellers from a <a href=""https://www.bag.admin.ch/bag/en/home/krankheiten/ausbrueche-epidemien-pandemien/aktuelle-ausbrueche-epidemien/novel-cov/empfehlungen-fuer-reisende/liste.html"" target=""_blank"">country with a variant of concern</a> who have not been vaccinated according to the requirements of the Swiss authorities or are unable to prove that they have recovered from COVID-19 within the last 6 months must go into quarantine after entering Switzerland.</p><p>The quarantine requirement also applies to children – even if the parents are fully vaccinated.</p><p>There is the possibility of shortening travel quarantine from day 7 onwards.</p><p>&nbsp;</p><p><b>Find out more:</b></p><p><a href=""https://www.bag.admin.ch/bag/en/home/krankheiten/ausbrueche-epidemien-pandemien/aktuelle-ausbrueche-epidemien/novel-cov/empfehlungen-fuer-reisende/quarantaene-einreisende.html#1918240392"" target=""_blank"">Rules for entering Switzerland</a></p><p><a href=""https://travelcheck.admin.ch/home"" target=""_blank"">Travelcheck tool</a></p><p>What to do after entering Switzerland</p><p><a href=""https://www.bag.admin.ch/bag/en/home/krankheiten/ausbrueche-epidemien-pandemien/aktuelle-ausbrueche-epidemien/novel-cov/empfehlungen-fuer-reisende/quarantaene-einreisende.html#103059051"" target=""_blank"">Exemptions to the testing and quarantine requirement</a></p><p><a href=""https://www.bag.admin.ch/bag/en/home/krankheiten/ausbrueche-epidemien-pandemien/aktuelle-ausbrueche-epidemien/novel-cov/empfehlungen-fuer-reisende/quarantaene-einreisende.html#accordion1622100669971"" target=""_blank"">Exemptions to the entry form requirement</a></p><br/><a href=""https://europa.eu/youreurope/citizens/travel/entry-exit/index_en.htm"">Documents you need to travel in Europe</a><br><a href=""https://europa.eu/youreurope/citizens/health/unplanned-healthcare/temporary-stays/index_en.htm"">Health cover for temporary stays</a>
<br><br>
*Transit: <p>Passengers in transit, such as air travellers who have to change their flight as well as bus/train travellers, must complete an <a href=""https://swissplf.admin.ch/"" target=""_blank"">entry form</a> before a stopover in Switzerland. They also have to present a negative test result, a proof of vaccination or a proof of recovery from COVID-19. They may be exempted from the testing requirement if they transit Switzerland without a stopover and without leaving the vehicle (e.g. refuelling stop when flying). They are also exempted from the requirement to submit the contact details.</p><p>&nbsp;</p><p>Additionally, the following rules apply:</p><p><b>Transit from a Schengen state to other Schengen state</b> <br />Entry from a Schengen state for the purpose of travelling on to another Schengen state is possible for anyone who is lawfully present in the Schengen area. <br /> </p><p><b>Transit from a Schengen state to a third country</b> <br />Entry from a Schengen state for the purpose of travelling on to a state outside the Schengen area is possible for anyone who is lawfully present in the Schengen area. <br /> </p><p><b>Transit from a third country considered by the SEM to be high-risk to a Schengen state</b> <br />Third-country citizens holding a residence document or a visa type D for their destination country in the Schengen area are permitted to travel through Switzerland to that country. <br />The <a href=""https://www.sem.admin.ch/sem/en/home/themen/einreise/faq.html"" target=""_blank"">normal requirements for entering Switzerland</a> apply.</p><p>It is only possible to enter Switzerland from a high-risk country in order to travel on to another Schengen state for a short stay of up to 90 days if you can prove that you have been vaccinated (see “How can I prove that I am vaccinated?”). Persons under 18 may enter Switzerland if they are travelling with an adult who has been vaccinated. <br />Otherwise the <a href=""https://www.sem.admin.ch/sem/en/home/themen/einreise/faq.html"" target=""_blank"">normal requirements for entering Switzerland</a> apply.</p><p>If you have not been vaccinated, but your destination country in the Schengen area has authorised your entry for a short stay of up to 90 days, you may only enter the Schengen area by travelling directly to your destination country (i.e. you may not travel though Switzerland). <br /> </p><p><b>Transit from a third country not considered by the SEM to be high-risk to a Schengen state</b> <br />When entering Switzerland from a third country that is not considered high-risk in order to travel on to another Schengen state, the <a href=""https://www.sem.admin.ch/sem/en/home/themen/einreise/faq.html"" target=""_blank"">normal requirements for entering Switzerland</a> apply. <br /> </p><p><b>Transit from a third country considered by the SEM to be high-risk to another third country</b> <br />It is not possible to enter Switzerland from a third country that is considered high-risk in order to travel on to another country outside the Schengen area, unless transiting through Zurich or Geneva airport. Travellers should check whether they require a transit visa. In such cases, travellers do not actually enter Switzerland but remain in the transit area of the airport. <br /><a href=""https://www.sem.admin.ch/dam/sem/en/data/rechtsgrundlagen/weisungen/visa/bfm/bfm-anh01-liste2-e.pdf.download.pdf/bfm-anh01-liste2-e.pdf"" target=""_blank"">Transit visa requirements: Passport and visa requirements not depending on citizenship (PDF, 337 kB, 18.03.2021) <br /></a> </p><p><b>Transit from a third country not considered by the SEM to be high-risk to another third country</b> <br />Entry into Switzerland from a third country which is not on the SEM high-risk list for onward travel to another country outside the Schengen area is possible subject to the normal entry and transit requirements (N.B. a transit visa may be required).</p>
<br><br>
*From Third Countries: <p><b>Entry from non high-risk countries </b><b>(as listed </b><a href=""https://www.sem.admin.ch/sem/en/home/sem/aktuell/faq-einreiseverweigerung.html#1668147653"" target=""_blank"">here</a>)</p><p>Entry to Switzerland is possible provided that the normal entry requirements are met when crossing the border (e.g. valid visa and travel document).</p><p>&nbsp;</p><p><b>Entry from high-risk countries</b></p><p>Entry from a high-risk country (that is not listed <a href=""https://www.sem.admin.ch/sem/en/home/sem/aktuell/faq-einreiseverweigerung.html#1668147653"" target=""_blank"">here</a>) is possible if one of the following criteria, as well as the normal entry requirements are met:</p><ul><li>You have Swiss citizenship.</li><li>You hold a travel document (e.g. a passport or identity card) and:<ul><li>aSwiss residence permit (L / B / C / Ci permit);</li><li>across-border permit (G permit),</li><li>anFDFA legitimation card;</li><li>aD visa issued by Switzerland;</li><li>aC visa issued by Switzerland after 16 March 2020 in a valid exceptional case or in order to work on a short-term contract;</li><li>anassurance of a residence permit</li><li>aconfirmation of notification for the cross-border provision of services up to 90 days in any calendar year (e.g. UK nationals).</li></ul></li><li>You hold a refugee’s or stateless person’s travel document issued by Switzerland, a passport for foreign nationals issued by Switzerland, a valid residence or permanent residence permit or an F-Permit.</li><li>You have rights of free movement. If you require a visa, a valid Schengen C-visa, a valid D-visa or a valid Schengen residence permit are sufficient.</li><li>You are in a situation of special necessity (see below). The border control authority will assess the necessity of the situation.</li><li>You can prove that they have been vaccinated with a recognised vaccine</li><li>You are under 18 and are travelling with an adult who has been fully vaccinated.</li><li>You are simply travelling directly through Switzerland with the intention and possibility of entering another country.</li></ul><p>You must be able to prove that you meet the abovementioned requirements. Suitable documentary proof must be produced at the border or when you apply for a visa.</p><p>Find out more Information: <a href=""https://www.sem.admin.ch/sem/en/home/sem/aktuell/faq-einreiseverweigerung.html"" target=""_blank"">Corona: Questions and answers on entry and stay in Switzerland, the exceptions and suspension of visas (admin.ch)</a> </p><p><b>Independent of the above-mentioned entry-requirements, health-related measures at the border may apply (see «</b><b>What are the rules to enter this country from an EU Member State or Schengen Associated country?”)</b></p><p><a href=""https://www.bag.admin.ch/bag/en/home/krankheiten/ausbrueche-epidemien-pandemien/aktuelle-ausbrueche-epidemien/novel-cov/empfehlungen-fuer-reisende/quarantaene-einreisende.html#1918240392"" target=""_blank"">Rules for entering Switzerland</a></p><p><a href=""https://travelcheck.admin.ch/home"" target=""_blank"">Travelcheck tool</a></p><p>All travellers entering Switzerland have to <b>provide a negative test result, proof of full vaccination, or proof of recovery</b>, independently from where they arrive. Additionally, they have to <b>provide their contact details</b>. The form for incoming travellers can be found under <a href=""https://swissplf.admin.ch/formular"" target=""_blank"">swissplf.admin.ch</a>.</p><p>&nbsp;</p><p>The following should be noted:</p><p>&nbsp;</p><p><b>Test requirement</b></p><p>Travellers who are not fully vaccinated or unable to prove that they have recovered from COVID-19 within the last 6 months will have to present proof of a negative PCR test (max. 72 hours old) or rapid antigen test (max. 48 hours old) upon entry. After four to seven days in Switzerland, another test must be carried out, subject to a fee. The result of the second test as well as the entry form number must be submitted to the <a href=""https://www.bag.admin.ch/bag/en/home/krankheiten/ausbrueche-epidemien-pandemien/aktuelle-ausbrueche-epidemien/novel-cov/empfehlungen-fuer-reisende/quarantaene-einreisende.html#-1675462321"" target=""_blank"">relevant cantonal office</a>.</p><p>Children under the age of 16 are never required to provide proof of a negative coronavirus test on entering Switzerland.</p><p>&nbsp;</p><p><b>Proof of vaccination</b></p><p>To be considered as fully vaccinated, people have to be vaccinated with a vaccine that:</p><ol><li>is <b>authorised in Switzerland</b> and which has been administered in full in accordance with the recommendations of the Federal Office of Public Health of Switzerland;</li><li>has been <b>authorised by the European Medicines Agency</b> for the European Union and has been administered in full in accordance with the requirements or recommendations of the country in which the vaccination was administered;</li><li>is <b>authorised under the WHO Emergency Use Listing</b> and has been administered in full in accordance with the requirements or recommendations of the country in which the vaccination was administered;</li><li>has been shown to have the same composition as a vaccine licensed under subparagraph (a), (b) or (c) but marketed by a licensee under a different name and which has been administered in full in accordance with the requirements or recommendations of the country in which the vaccination was administered</li></ol><p>The vaccination is regarded as being effective for 12 months from the date on which it was administered in full; one dosis vaccines are regarded as being effective for 12 months from the 22nd day after they were administered in full.</p><p>Proof of vaccination may be provided in the form that is customary at the time. In addition to the surname, forename and date of birth of the person concerned, it must include the following information:</p><ul><li>the date of vaccination;</li><li>the vaccine used.</li></ul><p>&nbsp;</p><p><b>Proof of recovery</b></p><p>Proof of recovery remains valid for 6 months from the 11th day following the confirmation of the infection.</p><p>Proof of recovery may be provided in the form that is customary at the time. In addition to the surname, forename and date of birth of the person concerned, it must include the following information:</p><ul><li>confirmation of the infection including the name and address of the confirming body (test centre, doctor, pharmacy, hospital);</li><li>confirmation that isolation has been terminated or confirmation of recovery from a doctor.</li></ul><p>&nbsp;</p><p><b>Entry from a country or area defined as COVID-19 risk area</b></p><p><b>Quarantine requirement</b></p><p>The Federal Office of Public Health provides a regularly updated list of <a href=""https://www.bag.admin.ch/bag/en/home/krankheiten/ausbrueche-epidemien-pandemien/aktuelle-ausbrueche-epidemien/novel-cov/empfehlungen-fuer-reisende/liste.html#858610174"" target=""_blank"">countries defined as COVID-19 risk area</a>, so called countries or areas with variants of concern. Entry from such countries is possible. Travellers who are not fully vaccinated or unable to prove that they have recovered from COVID-19 within the last 6 months will have to present proof of a negative PCR test (max. 72 hours old) or rapid antigen test (max. 48 hours old) upon entry. After four to seven days in Switzerland, another test must be carried out, subject to a fee. The result of the second test as well as the entry form number must be submitted to the <a href=""https://www.bag.admin.ch/bag/en/home/krankheiten/ausbrueche-epidemien-pandemien/aktuelle-ausbrueche-epidemien/novel-cov/empfehlungen-fuer-reisende/quarantaene-einreisende.html#-1675462321"" target=""_blank"">relevant cantonal office</a>. Additionally, travellers from a <a href=""https://www.bag.admin.ch/bag/en/home/krankheiten/ausbrueche-epidemien-pandemien/aktuelle-ausbrueche-epidemien/novel-cov/empfehlungen-fuer-reisende/liste.html"" target=""_blank"">country with a variant of concern</a> that have not been vaccinated according to the requirements of the Swiss authorities or are unable to prove that they have recovered from COVID-19 within the last 6 months must go into quarantine after entering Switzerland.</p><p>The quarantine requirement also applies to children – even if the parents are fully vaccinated.</p><p>There is the possibility of shortening travel quarantine from day 7 onwards.</p><p>&nbsp;</p><p><b>Find out more:</b></p><p><a href=""https://www.bag.admin.ch/bag/en/home/krankheiten/ausbrueche-epidemien-pandemien/aktuelle-ausbrueche-epidemien/novel-cov/empfehlungen-fuer-reisende/quarantaene-einreisende.html#1918240392"" target=""_blank"">Rules for entering Switzerland</a></p><p><a href=""https://www.bag.admin.ch/bag/en/home/krankheiten/ausbrueche-epidemien-pandemien/aktuelle-ausbrueche-epidemien/novel-cov/empfehlungen-fuer-reisende/quarantaene-einreisende.html#-1306781457"" target=""_blank"">What to do after entering Switzerland</a></p><p><a href=""https://www.bag.admin.ch/bag/en/home/krankheiten/ausbrueche-epidemien-pandemien/aktuelle-ausbrueche-epidemien/novel-cov/empfehlungen-fuer-reisende/quarantaene-einreisende.html#103059051"" target=""_blank"">Exemptions to the testing and quarantine requirement</a></p><p><a href=""https://www.bag.admin.ch/bag/en/home/krankheiten/ausbrueche-epidemien-pandemien/aktuelle-ausbrueche-epidemien/novel-cov/empfehlungen-fuer-reisende/quarantaene-einreisende.html#accordion1622100669971"" target=""_blank"">Exemptions to the entry form requirement</a></p><p><a href=""https://www.bag.admin.ch/bag/en/home/krankheiten/ausbrueche-epidemien-pandemien/aktuelle-ausbrueche-epidemien/novel-cov/empfehlungen-fuer-reisende/quarantaene-einreisende.html#-1675462321"" target=""_blank"">Contact details of the cantonal authorities</a></p>
<br> <br>
Internal Restrictions: <br>
*COVID-19 restrictions: Switzerland has put measures in place to limit the spread of COVID-19. You should follow the <a href=""http://www.bag.admin.ch/protect-yourself-and-others"">rules on hygiene and social distancing</a>. These include: <br>
•        Keeping a distance of at least 1.5 metres from other people <br>
•        If it is not possible to maintain that distance, wearing a face mask <br>
Wearing a face mask is compulsory when travelling on public transport and when indoors in publicly accessible areas. Further information on masks is available on the <a href=""https://www.bag.admin.ch/bag/en/home/krankheiten/ausbrueche-epidemien-pandemien/aktuelle-ausbrueche-epidemien/novel-cov/masken.html#11550956"">Federal Office of Public Health website</a>. Failure to wear a mask is punishable by a fine. Children under the age of 12 are exempt from this requirement, as are individuals who are unable to wear a mask for medical reasons. <br>
Proof of vaccination, proof of recovery from a COVID-19 infection or a negative test result (up to 48 hours for a rapid antigen test or 72 hours for a PCR test) is required for entry into: <br>
•        Large-scale outdoor events attended by over 1,000 people. Indoor hospitality venues including restaurants, bars, clubs and discos<br>
•        Cultural, sporting and leisure activities indoors. This includes museums and libraries, leisure facilities, zoos, casinos, fitness centres and sports facilities, indoor pools and water parks<br>
•        Indoor events including theatre and cinema, concerts, sporting events and private events outside the home (e.g. weddings) <br>
Children under the age of 16 are exempt from this requirement. <br>
Switzerland will accept a certification of a vaccination. However a screenshot or a photo is not sufficient. Further information is available from the <a href=""https://www.sem.admin.ch/sem/en/home/sem/aktuell/faq-einreiseverweigerung.html#-1871257744"">State Secretariat for Migration</a>. If you are travelling with a printed PDF proof of vaccination status, it must date from 1 November to ensure that the certificate can be scanned successfully, if domestic certification is required. <br>
Further information is available from the <a href=""https://www.bag.admin.ch/bag/en/home/krankheiten/ausbrueche-epidemien-pandemien/aktuelle-ausbrueche-epidemien/novel-cov/massnahmen-des-bundes.html"">Federal Office of Public Health</a>.<br>
Cantons may imposed further restrictions, and you should check <a href=""https://www.ch.ch/de/coronavirus/#informationen-und-kontakte-in-den-kantonen"">cantonal websites</a> for further details.
","<a href=""https://www.gov.uk/foreign-travel-advice/switzerland/staying-during-coronavirus"">Foreign travel advice, Gov.UK</a>/ 
  <a href=""https://reopen.europa.eu/en/map/CHE"">Re-open Europe</a>/ 
  <a href=""https://ch.usembassy.gov/covid-19-info/"">US State Dept. COVID-19 Country Specific Information</a>/ 
  <a href=""https://www.dfae.admin.ch/eda/fr/home.html"">Swiss Authorities</a>/
 <a href=""https://www.swissinfo.ch/eng/covid-19_coronavirus--the-situation-in-switzerland/45592192"">Covid Government Page</a>/"
