20211008,"COVID-19 negative certification required for entering the country.

Entry into China is subject to the certification of a Health Declaration Form from a Chinese Embassy for which you must provide evidence of negative nucleic acid and IgM antibody tests for COVID-19 taken no more than 48 hours before you travel. ","Quarantine requirement at government designated site.

Following health checks on arrival, you will then need to enter quarantine for at least 14 days. At some points of entry children 14 and over will be required to quarantine alone irrespective of whether they test positive or negative for COVID. <br>
You will be separated from your child if one of you tests positive for coronavirus.  Non-residents may be charged for their care. <br>
Quarantine is usually spent at either a centralised government hotel (with costs covered by the traveller) or your home. Quarantine requirements can change at short notice and may differ from province to province.","<a href=""https://www.gov.uk/foreign-travel-advice/china"">Foreign travel advice, Gov.UK</a>/ 
  <a href=""https://www.osac.gov/Content/Browse/Report?subContentTypes=Alerts%2CTravel%20Advisories"">OSAC Travel Advisories</a>/ 
  <a href=""https://china.usembassy-china.org.cn/covid-19-information/"">US State Dept. COVID-19 Country Specific Information</a>/
  <a href=""http://en.nhc.gov.cn/"">National Health Commission</a>/","Latest News: More flights canceled at Beijing airports on 3 November because of COVID-19 (Reuters, 03.11.2021). Authorities in Beijing impose new restrictions because of rise in COVID-19 cases (Republic World, 01.11.2021)
 <br>
 <br>
 International Restrictions:<br>
 *Entry and transit: The Chinese authorities have suspended all direct flights from the UK. This measure will be subject to review but no date has been announced. Restrictions on travel to China from other countries, and the necessary requirements, may be different. Foreign including British nationals travelling to China from a third country should follow the directions on the website of the local Chinese Embassies or consulate for requirements from that country.
On 4 November the Chinese Embassy in some country announced the temporary suspension of entry into China by non-Chinese. Foreign nationals visiting China for emergencies can still apply for visas at Chinese Embassies or Consulates and entry by non-Chinese nationals in other country with visas issued after 3 November 2020 will not be affected. <br>
If you’re issued a visa to travel to China you will need to submit a Health Declaration Form to your nearest Chinese Embassy or Consulate before you travel, who will need to certify your form and return it to you via email. In order to receive a Health Declaration Form from the Chinese Embassy you must provide evidence of negative nucleic acid and IgM antibody tests for COVID-19 taken no more than 48 hours before you travel. <br>
Reports of both your nucleic acid (COVID-19) and IgM (antibody) tests must come from the same service provider. This does not mean the provider must carry out both tests, but that the provider must guarantee both test reports. You should arrange to take a private test.
On 15 March the Chinese authorities announced a relaxation of certain requirements for visa applicants who can prove inoculation with a vaccine produced in China. Travellers who have not had a vaccine are still able to enter China under the existing, limited circumstances described above. A limited number of international flights from other countries are flying into Beijing. Other international passenger flights to Beijing continue to be diverted to 16 designated airports in Chengdu, Changsha, Hefei, Lanzhou, Tianjin, Shijiazhuang, Taiyuan, Hohhot, Jinan, Qingdao, Nanjing, Shenyang, Dalian, Zhengzhou, Xi’an and Wuhan. A small number of international flights are also operating direct between European cities and Shanghai, Guangzhou and Qingdao. <br>
*Demonstrating your COVID-19 vaccination status: China has not yet confirmed that it will accept the solutions for demonstrating your COVID vaccination status. You should follow guidance for alternative entry requirements. Your appointment card from vaccination centres is not designed to be used as proof of vaccination. <br>
*Health checks on arrival: All overseas passenger arrivals are subject to health checks on arrival (likely involving nucleic acid or swab tests). Those failing health checks may be sent to a designated hospital for treatment.  Health regulations surrounding passengers arriving from overseas are continuously changing. You should contact your local Chinese Embassy before you travel if you have any questions regarding these entry requirements, quarantine rules or the requirements for individual cities.
*Quarantine requirements: Following health checks on arrival, you will then need to enter quarantine for at least 14 days. At some points of entry children 14 and over will be required to quarantine alone irrespective of whether they test positive or negative for COVID. <br>
You will be separated from your child if one of you tests positive for coronavirus.  Non-residents may be charged for their care. <br>
Quarantine is usually spent at either a centralised government hotel (with costs covered by the traveller) or your home. Quarantine requirements can change at short notice and may differ from province to province. <br>
Follow-up swab tests are likely to take place during your quarantine period. Family members of someone who tests positive, or those who have been in close contact, will need to go into a government quarantine hospital. <br>
For all quarantine arrangements in China: <br>
•        unless directed by the authorities you’re not allowed to leave your designated quarantine location for 14 days. This means you’re also unable to leave China for the duration of the quarantine <br>
•        depending on the quarantine location, facilities may be basic: there may be no fridge, no air-conditioning, and limited or no internet/wifi <br>
•        during your stay you will be responsible for cleaning the room <br>
•        if meals are not available at the quarantine location, you will need to arrange food orders for delivery from outside <br>
•        larger sized families with two parents may be separated into 2 rooms. <br>
•        if you’re on prescription medication make sure you bring enough with you to last for at least 3-4 weeks together with medical documents certifying that you need to take this medication. <br>
•        Failure to comply with the quarantine conditions or testing put in place, or any attempts to deliberately conceal health conditions can result in being sentenced to up to three years in prison. This applies to both Chinese and foreign nationals.
  <br>
  <br> 
Internal Restrictions: <br>
 *Travel in China: Mandatory requirements to check temperatures and use health kit apps or scan QR codes to prove travel history are in place at transport hubs, hotels, commercial buildings including restaurants, residential compounds and other locations. <br>
Restrictions on movement and quarantine arrangements remain for travel between different parts of the country. Some cities and provinces need travellers from high to medium risk areas to undergo 14 days of isolation in their place of residence or in centralised observation. Quarantine is enforced at the neighbourhood level and procedures vary, so check in advance. <br>
The possibility that local authorities impose mandatory quarantine in response to fresh outbreaks is high. There have been reports of individuals who have frequented bars or restaurants where there have been confirmed cases of COVID-19 being mandated to undergo 14 days of centralised quarantine. You should keep up to date with the latest developments and this travel advice, including requirements for evidence of a negative COVID-19 NAT test within 48 hours of travel from high to medium risk areas. <br>
There have been reports of discrimination against foreign nationals in China as a result of a perceived risk that they might re-import COVID-19. In Guangzhou, in particular, there have been reports of discrimination on the basis of ethnicity, especially of those who are black and minority ethnic, including additional enforced quarantine and testing, as well as hotels and businesses not serving clients. <br>
*If you test positive for COVID-19, you may need to stay where you are until you test negative. You may also need to seek treatment there.
"
