20220107,"COVID-19 negative certification required for entering the country. 

You must have proof of a recent (no older than 72 hours before first boarding) negative coronavirus PCR test to board your flight to Cameroon and to enter at Yaoundé or Douala Airports. <br>
The Government of Cameroon demands a negative Coronavirus PCR test from all travellers aged five and above. Your negative coronavirus test result should be in PDF format, clearly stating the date of the test and the type of test (which should be PCR). Electronic copies are accepted.","Quarantine requirement at government designated site. 

If you have a proof of a recent (no older than 72 hours before boarding) negative coronavirus test, you will normally not have to self-isolate. Anyone that has developed symptoms of Coronavirus on their travel or tests positive on arrival at Yaoundé or Douala airport will be held for further enquiries to trace contacts and movements. We believe that anyone testing positive can quarantine at the location of your host or private accommodation until a negative PCR test is produced",,"Latest News: 
 <br>
 <br>
Internations Restrictions:<br>
 *Entry to Cameroon: There are multiple commercial flight options to enter and leave Cameroon. Access across Cameroon’s land and sea borders is currently restricted due to COVID-19. <br>
Travel requirements to enter and exit Cameroon can change without notice and without proactive communication. The Centre for the Coordination of Public Health Emergency Operations conditions of entry and exit to Cameroon <a href=""https://www.ccousp.cm/urgences-sanitaires/Fcovid-19/condition-dentree-et-sortie-au-cameroun/"">website</a> is the best source of the latest information. <br>
You must have proof of a recent (no older than 72 hours before first boarding) negative coronavirus PCR test to board your flight to Cameroon and to enter at Yaoundé or Douala Airports. <br>
The Government of Cameroon demands a negative Coronavirus PCR test from all travellers aged five and above. (Some airlines demand a PCR test from travellers aged two and above, so check with your airline.)
Your negative coronavirus test result should be in PDF format, clearly stating the date of the test and the type of test (which should be PCR). Electronic copies are accepted. You should arrange to take a private test. <br>
*Testing/screening on arrival: All international travellers are subjected to extra, rapid flow, testing for Coronavirus on arrival at Yaoundé and Douala international airports. This is the Rapid Flow test. At present this includes all passengers arriving from Europe, including the UK. These tests are compulsory. Results are returned while passengers are at the airport. There is no fee. <br>
This is in addition to the requirement to have a negative PCR test 72 hours before embarkation on the first leg of your journey to Cameroon.
*Quarantine requirements: If you have a proof of a recent (no older than 72 hours before boarding) negative coronavirus test, you will normally not have to self-isolate. Anyone that has developed symptoms of Coronavirus on their travel or tests positive on arrival at Yaoundé or Douala airport will be held for further enquiries to trace contacts and movements. We believe that anyone testing positive can quarantine at the location of your host or private accommodation until a negative PCR test is produced.These requirements are regularly evolving. <br>
*Exit Requirements: All travellers leaving Cameroonian territory must present a negative PCR or a rapid flow test result at the airport from the last 72 hours. You should take a PCR test, with a QR barcode. Your country of destination or transit may have other requirements. <br>
Travellers leaving Cameroon are frequently asked for their Yellow Fever certificate as they pass through security. You should carry it with you as you pass through the airport.<br>

  <br>
  <br> 
  Internal Restrictions: <br>
 *Travel in Cameroon: Travel within the country should be limited to essential travel only. The authorities have banned public transport (taxis, buses, motorbikes) from taking more passengers than they have seats. <br>
You must wear a mask or face covering to be allowed to enter any airport in Cameroon.  <br>
*Accommodation: Accommodation is generally open at the current time. <br>
*Public places and services: Gatherings of over 50 people are prohibited. Restrictions on bars, restaurants and entertainment spots have been lifted. <br>
Visits to public institutions, including government buildings, have been limited.
You must wear a face mask in public spaces and there is occasional sanctioning of those people found to have breached restrictions and any confinement measures imposed on them. <br>
Schools and other educational establishments have reopened after closure during the summer of 2020. However, in the North West and South West regions, many remain closed due to the ongoing conflict. <br>
*If you test positive for COVID-19, you may need to stay where you are until you test negative. You may also need to seek treatment there.
","<a href=""https://www.gov.uk/foreign-travel-advice/cameroon"">Foreign travel advice, Gov.UK</a>/ 
  <a href=""https://www.osac.gov/Content/Browse/Report?subContentTypes=Alerts%2CTravel%20Advisories"">OSAC Travel Advisories</a>/ 
  <a href=""https://cm.usembassy.gov/health-alert-u-s-embassy-yaounde/"">US State Dept. COVID-19 Country Specific Information</a>/
  <a href=""http://covid19.minsante.cm/"">Ministry of Health</a>/"
