20211228,"COVID-19 negative certification required for entering the country. 
<br>
From 27DEC21, all incoming travelers in Denmark are subject to the requirement of negative results of a pre-entry COVID-19 test. Accepted are PCR tests performed 72 hours before entry, and rapid tests performed 48 hours before entry. Subject to the new requirement are also EU nationals and those who have been vaccinated against COVID-19, whereas those who have previously recovered from COVID-19 are exempt from the new obligation.<br>
<br> 
All travellers from an EU Member State or Schengen Associated country do not need to self-isolate after entry. This applies regardless of whether you are neither fully vaccinated nor have previously been infected. The testing requirements is also waived after entry if you can present a valid EUDCC. Please note that if you are unable to present a valid EUDCC, you must be tested within 24 hours after entering Denmark. Children below 15 years are exempt from quarantine and testing requirements.<br>
Entry requirements depend on the country of departure, according to DENMARK <a href=""https://en.coronasmitte.dk/travel-rules/categorization-of-countries"">classification of risk areas</a>. Denmark classifies countries as EU/Schengen countries, OECD countries, Risk countries/Regions and areas, High risk countries and Countries able to document their vaccination with the EU Digital Certificate. <br>
Travellers can access DENMARK if they hold one of the following documents: <br>
•   Proof of full vaccination, completed at least more than two weeks and less than 12 months before travelling. Accepted vaccines: BioNTech and Pfizer, Moderna, AstraZeneca, Janssen Pharmaceutica NV, <br>
•   Proof of recovery from COVID-19. Validity: recovery attested more than 14 days but less than 12 months. <br>
•   Both PCR tests and rapid antigen tests (RAT) : PCR test within the past 96 hours or with the rapid antigen test (RAT) within 72 hours (such as upon entering Denmark). <br>
Travellers who cannot provide any of these documents must: <br>
•   Test before or after entry within 24 hours after arrival from EU/Schengen Countries according to the Danish classification. <br>
•   Test after entry: If you are not vaccinated or previously infected you must take a test within 24 hours after entry from Covid-19 Risk Countries/ Regions and Areas according to Danish classification. This also applies even though you have taken a test before entry. <br>
•   Test and self-isolate: within 24 hours upon arrival and self-isolate for 10 days after arriving in Denmark, after entering from a COVID-19 high-risk country according to the Danish classification. You may end the isolation with a negative PCR-test taken at least four days after arrival. <br>
The following persons and venues/events are exempt from the Corona passport requirement <br>
•   Children under 15. <br>
•   Persons who can provide documentation which has been issued and signed by a municipal citizens service centre that they are exempt from having to have a COVID-19 test. <br>
•   Participants in political meetings, polling, elections, election events.







","Self-isolation at own accommodation. <br>
Arrivals from South Africa and neighbouring Lesotho, Eswatini (Swaziland), Mozambique, Zimbabwe, Botswana, Namibia, Angola, Malawi and Zambia are no longer obliged to quarantine upon arrival as the areas represent a similar risk of the spread of Omicron virus variant, as Denmark already does. The measure enters into force today on 23DEC21 and enables arrivals from these countries to enter Denmark by presenting a vaccination, recovery, test certificate or any other document equally valid to the EU Digital COVID-19 Certificate.<br>
EU/Schengen-countries: Travellers may enter Denmark from EU/Schengen-countries without test or self-isolation: <br>
•   Fully vaccinated residents in EU/Schengen <br>
•   Fully vaccinated residents in OECD-countries <br>
•   Fully vaccinated travellers from risk-countries <br>
•   Fully vaccinated travellers who can document vaccination with the EU corona passport or with a vaccination certificate, which is equal to the EU digital COVID-19 certificate <br>
•   Previously infected travellers from all countries <br>
Children below 15 years are exempt from quarantine and testing requirements.<br>
Entering this country without the EU Digital COVID certificate or with a certificate not compliant with national requirements. Travellers can access DENMARK if they hold one of the following documents: Proof of full vaccination, Proof of recovery from COVID-19, Both PCR tests and rapid antigen tests (RAT): PCR test within the past 96 hours or with the rapid antigen test (RAT) within 72 hours (such as upon entering Denmark).<br>
Travellers who cannot provide any of these documents must:<br>
•  Test and self-isolate:  within 24 hours upon arrival and self-isolate for 10 days after arriving in Denmark, after entering from a <a href=""https://en.coronasmitte.dk/travel-rules/covidtravelrules#entryforms"">COVID-19 high-risk country</a> according to Denmark’s classification. You may end the isolation with a negative PCR-test taken at least four days after arrival.<br>



","THIS COUNTRY IS ALREADY CONNECTED TO THE GATEWAY AND IS ISSUING AND/OR VERIFYING AT LEAST ONE EU DIGITAL COVID CERTIFICATE (VACCINATION, RECOVERY, TEST) <br>
All holders of a valid COVID-19 certificate documenting full vaccination, previous in- fection or a valid test may enter Denmark without being subject to travel restrictions. <br>
Entry requirements depend on the country of departure, according to the Danish classification of risk areas. Denmark classifies countries as EU/Schengen countries, OECD countries, Risk countries/Regions and areas, High risk countries and Countries able to document their vaccination with the EU Digital Certificate. <br>
EU/Schengen-countries: Travellers may enter Denmark from EU/Schengen-countries without test or self-isolation: <br>
Fully vaccinated residents in EU/Schengen <br>
Fully vaccinated residents in OECD-countries <br>
Fully vaccinated travellers from risk-countries <br>
Fully vaccinated travellers who can document vaccination with the EU corona passport or with a vaccination certificate, which is equal to the EU digital COVID-19 certificate <br>
Previously infected travellers from all countries <br>
Important: Denmark identifies the following countries as Countries able to document their vaccination with the EU Digital Certificate, meaning with a vaccination certificate, which Denmark considers equal to the EU’s digital COVID-19 certificate: Albania, Armenia, Georgia, Israel, Moldova, Morocco, New Zealand, North Macedonia, Panama, Serbia, Turkey, Ukraine, and United Kingdom. <br>
","Latest News: Danish government ends strict COVID-19 travel restrictions, including mandatory quarantine, for arrivals from 10 Southern African countries (SVI, 23.12.2021). Airline passengers arriving to Denmark from Doha, Dubai must take mandatory COVID-19 test  (Reuters, 01.12.2021)
  <br>
  <br>
International Restrictions: <br>
*From within the EU: <p><strong>Important:</strong> Denmark identifies the following countries as <strong>countries able to document their vaccination with the EU Digital Certificate</strong>, meaning with a vaccination certificate, which Denmark considers equal to the EU&rsquo;s digital COVID-19 certificate: Albania, Armenia, Georgia, Israel, Moldova, Morocco, New Zealand, North Macedonia, Panama, Serbia, Turkey, Ukraine and United Kingdom.</p><p></p><p><strong>Mandatory travel documentation</strong></p><p>All travellers entering Denmark must present a negative test conducted within 48 hours prior to their arrival regardless of whether they can present a vaccination certificate or not.</p><p><strong>Exception</strong>: the following categories are exempt from the above-mentioned test requirement</p><ul><li>Children under 15 years of age</li><li>Persons residing in border regions entering Sweden from transit from Bornholm without residence in Sweden</li><li>Persons entering for the purpose of freight transport</li><li>Persons in transit through Denmark departing within 24 hours of entry</li></ul><p></p><p>Travellers can access DENMARK if they hold one of the following documents:</p><ul><li><strong>Proof of full vaccination</strong>, completed at least more than two weeks and less than 12 months before travelling. Accepted vaccines: <a href=""https://www.ema.europa.eu/en/news/ema-receives-application-conditional-marketing-authorisation-covid-19-mrna-vaccine-bnt162b2"">BioNTech and Pfizer</a>, <a href=""https://ec.europa.eu/commission/presscorner/detail/en/ip_21_3"">Moderna,</a> <a href=""https://ec.europa.eu/commission/presscorner/detail/en/ip_21_306"">AstraZeneca</a>, <a href=""https://ec.europa.eu/commission/presscorner/detail/en/ip_21_1085"">Janssen Pharmaceutica NV</a>,</li><li><strong>Proof of recovery from COVID-19</strong>. Validity: recovery attested more than 14 days but less than 12 months.</li></ul><p></p><p></p><p></p><p><strong>Find out more:</strong></p><p><strong></strong></p><p><a href=""https://en.coronasmitte.dk/"">General information</a></p><p><a href=""https://sum.dk/english"">National health institute</a></p><br/><a href=""https://europa.eu/youreurope/citizens/travel/entry-exit/index_en.htm"">Documents you need to travel in Europe</a><br><a href=""https://europa.eu/youreurope/citizens/health/unplanned-healthcare/temporary-stays/index_en.htm"">Health cover for temporary stays</a>
<br>
*Transit: <p>As a general rule, passengers in transit in the EU+ area are exempted from temporary travel restrictions.</p><p>EU citizens entering the EU from a third country, as well as their family members, irrespective of their nationality, are exempted from the travel restrictions regardless of whether or not they are returning to their country of nationality or residence.</p><p>Passengers travelling from a non-EU country to another non-EU country may transit through the international transit area of airports located in the Schengen area. Rules regarding airport transit visa requirements continue to apply.</p><p>Additionally, for Denmark, <strong>the following rules apply</strong>:</p><p>You can travel through Denmark (transit) if you have a worthy purpose outside Denmark or you are going on holiday outside Denmark, the Faroe Islands and Greenland or as part of your homebound journey. This applies regardless of your habitual residence and your means of transport into and out of Denmark.</p><p>If you want to transit through Denmark, you must present a&nbsp;<strong>negative PRC-test taken no more than 72 hours before the time of entry, or an antigen test taken no more than 48 hours before entry</strong>.</p><p>The test must be presented in connection with the last ﬂight that has a destination in Denmark. The airline ﬂying the last ﬂight must make sure that the test was taken within 48 hours of boarding the ﬁrst leg/part of the journey. This documentation may be in the form of a boarding pass or other proof showing the time of start of the continuous journey. As an alternative, the passenger can take a test during the continuous journey, but prior to the ﬂight with destination in Denmark.</p><p class=""border"">From 1 May, <strong>fully vaccinated persons</strong> who are permanent residents of ""yellow"" EU and Schengen countries, and who can document that they have completed a course of vaccination in an EU/Schengen country, are <strong>exempt from the testing and isolation requirements</strong> on entering Denmark. Full details on conditions and requirements are available at <a href=""https://en.coronasmitte.dk/rules-and-regulations/entry-into-denmark/legal-requirements-upon-entry"" target=""_blank"">coronasmitte.dk</a>.</p><p>The requirement to present a negative COVID-19 test does not apply to foreigners habitually resident abroad who fall within one or several of the groups below:</p><ul><li>Foreigners who enter in connection with the transportation of freight;</li><li>Foreigners who enter Denmark as air crew members (whether on or off duty) after having performed their job or having undertaken such function abroad and are in transit;</li><li>Foreigners who are crew members on trains, buses, ships, taxis or any other commercial passenger transportation vehicle operating under permission of the Danish Taxi Act (<em>taxiloven</em>) and are in transit;</li><li>Foreigners who enter Denmark in emergency vehicles on duty;</li><li>Foreigners who can present a positive COVID-19 test taken at least two weeks but no more than 12 weeks before entry (as the person is no longer assumed to be contagious).</li></ul><p>If you transit through Denmark, but you do not enter Denmark, for example, if you are in airport transit and you do not leave the transit area, you are not required to present a negative COVID-19 test upon arrival to Denmark. However, you are not exempted from the test requirement for people arriving to Denmark by plane.</p><p>&nbsp;</p><p><strong>Find out more: </strong></p><p><a href=""https://en.coronasmitte.dk/rules-and-regulations/entry-into-denmark/foreigners-in-transit"" target=""_blank"">Foreigners in</a><a href=""https://en.coronasmitte.dk/rules-and-regulations/entry-into-denmark/foreigners-in-transit"" target=""_blank""> trans</a><a href=""https://en.coronasmitte.dk/rules-and-regulations/entry-into-denmark/foreigners-in-transit"" target=""_blank"">it</a></p>
<br>
*From Third Countries: <p>Entry conditions vary according to whether the country of origin is classified as green, yellow, orange or red. These colour categories determine which rules apply to you on your arrival in Denmark. </p><p>Countries and regions are classified weekly on the basis of the prevailing health situation in each individual country and region. See the list of countries here: <a href=""https://en.coronasmitte.dk/rules-and-regulations/entry-into-denmark/categorization-of-countries"" target=""_blank"">Categorization of countries</a></p><p>Danish nationals and foreigners who are residents or hold a valid residence permit in Denmark can always enter Denmark, regardless of their purpose. More information is available on <a href=""https://en.coronasmitte.dk/rules-and-regulations/entry-into-denmark/danish-nationals-or-persons-resident-in-denmark-or-holding-a-valid-residence-permit-to-denmark"" target=""_blank"">https://en.coronasmitte.dk</a></p><p>The Danish government has developed an interactive tool for determining which rules apply in different scenarios. The tool is available here: Travelling to Denmark as a tourist (<a href=""https://en.coronasmitte.dk/covidtravelrules"" target=""_blank"">https://en.coronasmitte.dk/covidtravelrules</a>). The information is also available in German (<a href=""https://en.coronasmitte.dk/covidtravelrules/de"">https://en.coronasmitte.dk/covidtravelrules/de</a>).</p><p>The Danish corona passport app is the Danish version of the EU&rsquo;s Digital COVID Certificate which can be used as documentation for test, vaccination, or restitution status in different countries. However, you should continue to observe other travel rules in place: Rules for entering Denmark</p><p>If you are not a Danish national or a resident of Denmark, which rules apply to you, depends among other things on the colour category of the country you are travelling from, the category of your country of residence, and whether you are vaccinated, previously infected or travelling on a negative test. </p><p>&nbsp;</p><p><strong>Travel from countries classified as yellow</strong></p><p>All entrants must take a second test (antigen or PCR) upon arrival. The test can be taken at the airport if travelling by plane or no later than 24 hours after entering Denmark if entering by crossing a land or sea border.</p><p>Persons previously infected with COVID-19 are exempt from the testing requirements if they can present a positive PCR test performed at least 2 weeks and at most 12 months before the time of entry.</p><p>Fully vaccinated persons who have permanent residency in an EU or Schengen country, or in Andorra, San Marino, Monaco, the Vatican City, an OECD member state (including Greenland and the Faroe Islands) or in a yellow third country, are also exempt from the testing requirements. These travellers are required to hold an EU Digital COVID certificate or to document vaccination by other valid means.</p><p>You are considered to be fully vaccinated once you have been vaccinated with a vaccine approved by the European Medicines Agency (EMA), and at least 2 weeks and no more than 12 months have elapsed since you completed your course of vaccination. </p><p>Children under 16 years old, as well as cargo personnel, aircrew and other transport categories, are exempt from the testing requirement.</p><p>&nbsp;</p><p><strong>Travel from countries classified as ""orange"" or ""red""</strong></p><p>Foreigners resident abroad and travelling from ""orange"" or ""red"" countries must demonstrate a ""worthy purpose"" to enter Denmark. <span lang=""EN-GB"">If not fully vaccinated, they must also present a negative PCR test taken no more than 72 hours before entry.</span></p><p>Worthy purposes are, for example:</p><ul><li>primary caregiver of minors;</li><li>relationship with a seriously ill or dying person in Denmark;</li><li>treatment at a healthcare institution;</li><li>participation to the birth of your child;</li><li>attendance of a funeral;</li><li>participation in legal proceedings;</li><li>you are a seaman, an aircraft crew member, a diplomat, etc.;</li><li>you enter Denmark in connection with the transport of goods.</li></ul><p>The complete list of worthy purposes is available here: Foreigners habitually resident abroad (<a href=""https://en.coronasmitte.dk/rules-and-regulations/entry-into-denmark/foreigners-resident-abroad"" target=""_blank"">https://en.coronasmitte.dk</a>)</p><p>&nbsp;</p><p><strong>Find out more:</strong></p><p><a href=""https://en.coronasmitte.dk/travel-rules"" target=""_blank"">Travel rules (en.coronasmitte.dk)</a></p>
<br><br>
Internal Restrictions:<br> 
*Corona passport: You need <a href=""https://en.coronasmitte.dk/corona-passport"">a valid corona passport</a> when entering:<br>
•        indoor restaurants, cafés, bars etc. These will close at 11pm and there is a ban on the sale of alcohol from 10pm to 5am.<br>
•        local services such as tattoo parlours, hairdressers, solariums and massage parlours.<br>
•        all visitors to sheltered housing, nursing homes and hospitals.<br>
A valid corona passport documents that you have either been vaccinated or previously infected within the last 6 months or that you can document a negative COVID-19 test taken within the last 72 hours (PCR) or 48 hours (rapid antigen).<br>
*Face masks: You must wear a <a href=""https://en.coronasmitte.dk/prevent-infection"">face mask</a>:<br>
•        on public transport, including travel by bus, train, light rail, metro, ferry and taxi. The requirement also applies to tour buses and domestic flights, as well as at train stations, metro stations, light rail stops and stations, ferry terminals and airports<br>
•        in retail stores, including grocery stores, shopping centres, department stores, arcades, and indoor markets, including takeaway locations in these places<br>
•        in public buildings (e.g. educational institutions, libraries), churches, hotels, and other cultural and commercial venues where there is public access<br>
•        in public and private hospitals and clinics<br>
•        in restaurants, cafes, bars and take away places when standing<br>
*Travel in Denmark: The Danish Government regularly monitors the risks of COVID-19, and adjusts measures in line with the levels of infection to contain the spread of Coronavirus.<br>
Seat reservations are required on all long distance trains and buses. Full details can be found on the <a href=""https://en.coronasmitte.dk/"">Coronavirus in Denmark website</a>.<br>
*Public spaces and services: Everyone should comply with the measures put in place in Denmark to limit the spread of coronavirus (COVID-19).<br>
Nightclubs, discos, theatres, cinemas, casinos, amusement parks, zoos, entertainment venues, museums and art galleries are closed.<br>
Denmark will accept the proof of COVID-19 recovery and vaccination record. If you are travelling with a printed PDF proof of vaccination status, it must date from 1 November to ensure that the certificate can be scanned successfully, if domestic certification is required. Your appointment card from vaccination centres is not designed to be used as proof of vaccination and should not be used to demonstrate your vaccine status.<br>











","<a href=""https://www.gov.uk/foreign-travel-advice/denmark"">Foreign travel advice, Gov.UK</a>/ 
  <a href=""https://dk.usembassy.gov/u-s-citizen-services/security-and-travel-information/covid-19-information/"">US State Dept. COVID-19 Country Specific Information</a>/
  <a href=""https://www.osac.gov/Content/Report/9d48bef5-7259-438c-ba2d-190464f5bc61"">OSAC Travel Advisories</a>/ 
  <a href=""https://reopen.europa.eu/en/map/DNK"">Re-open Europe</a>/
  <a href=""https://politi.dk/en/travel"">Danish Police</a>/"
