0,"COVID-19 negative certification required for entering the country.  <br>
You must also present a negative Real-Time Polymerase Chain Reaction (RT-PCR) qualitative test for COVID-19, taken up to 72 hours prior to your arrival in the country. This is a mandatory requirement, which airlines are responsible for enforcing in order to allow passengers to board. <br>
All travellers over 2 years old wishing to enter the Islands must present a negative Polymerase Chain Reaction (PCR) test for COVID-19, taken up to 72 hours prior to the date of the flight to the Galapagos Islands. ","Self-isolation at own accommodation- subject to testing.

Passengers who test positive in the antigen test taken at the airport will need to self-isolate for 10 days, from the date of the test. Self-isolation for non-residents can be carried out in any hotel, at their own expense. The full address of where the passenger will self-isolate should be included in the Health Status Declaration Form. <br>
Local residents and people qualified as “priority attention groups” such as people over 65 years old, children and pregnant women, will be allowed to self-isolate at their homes. <br>
The Ministry of Public Health has published <a href=""https://coronavirusecuador.com/"">more information on coronavirus protocols</a> that also allows for direct messaging with the Ministry (Spanish only). <br>
If you need to find emergency accommodation to go through the mandatory self-isolation protocol, you can access options on the <a href=""https://www.salud.gob.ec/aislamiento-preventivo-obligatorio-apo-documentos-normativos-covid19/"">Ministry of Public Health website</a> <br>
The Government will monitor the situation in other countries with high risk of contagion to prevent incoming flights. <br>","
As of 22 March 2021, travellers who have had their full COVID-19 vaccination (i.e. both doses for those vaccinations which consist of two doses), received at least 14 days prior the flight date, can present their vaccination card, or its equivalent, instead of the above negative RT-PCR or rapid test result. However, the use of “Immunity Certificates or Vaccination Certificates/Cards” from foreign passengers will be subject to constant review.","Latest news: 
 <br>
 <br>
 International Restrictions: <br>
*Entry to Ecuador: All land borders with Colombia and Peru remain closed until further notice. However, Ecuadorean nationals and foreign residents may be allowed to enter Ecuador, via Rumichaca and Huaquillas northern and southern borders. All ports remain closed. <br>
As of 1 June 2020, international commercial flights have resumed operations to and from Ecuador. However, following the identification of a new variant of Coronavirus, we highly recommend you to contact your airline/travel company to check your travel itinerary. <br>
As of October 2021, international cruise ship operations are authorised at the following ports: Esmeraldas, Manta, Guayaquil and Puerto Bolivar. However, there are strict guidelines and measures to comply with to obtain the relevant permissions from the competent Ecuadorean authorities. <br>
*Testing / screening on arrival: Upon arrival in Ecuador, all passengers will be required to complete a  <a href=""https://www.salud.gob.ec/wp-content/uploads/2021/08/formulario_de_salud_del_viajero_.pdf"">Health Declaration Form</a> with their itinerary and local contact details. You must also present a negative Real-Time Polymerase Chain Reaction (RT-PCR) qualitative test for COVID-19, taken up to 72 hours prior to your arrival in the country. This is a mandatory requirement, which airlines are responsible for enforcing in order to allow passengers to board. <br>
Travellers who have had their full COVID-19 vaccination (i.e. both doses for those vaccinations which consist of two doses), received at least 14 days prior the flight date, can present their vaccination card, or its equivalent, instead of the above negative RT-PCR. However, the use of “Immunity Certificates or Vaccination Certificates/Cards” from foreign passengers will be subject to constant review. <br>
Passengers in transit are not subject to the submission of the above COVID-19 test or vaccination card. You should arrange to take a private test. <br>
Only airline crew members, children under 2 years old and passengers on transit to other countries are exempt from the RT-PCR test or the COVID-19 vaccination certificate requirement. <br>
If, on arrival, a passenger presents COVID-19 related symptoms, they will be evaluated by an MSP health care worker, prior to their entry to the immigration area, and, if necessary, an Antigen rapid test will be arranged. If the result us positive, COVID-19 protocols will be activated and the passenger will be instructed to self isolate. <br>
All passengers arriving from India, even if they have only transited those countries, must present a negative RT-PCR test, taken up to 72 hours prior to boarding their flight, regardless of whether they are fully vaccinated or not. These passengers must self isolate for 10 days either in a private home or in a hotel, at their own expense. The Ministry of Public Health (MSP) is responsible for following up this requirement. <br>
*Demonstrating your COVID-19 status: Ecuador will accept theproof of COVID-19 recovery and vaccination record. Your appointment card from vaccination centres is not designed to be used as proof of vaccination and should not be used to demonstrate your vaccine status.
*Quarantine requirements: Passengers who test positive in the antigen test taken at the airport will need to self-isolate for 10 days, from the date of the test. Self-isolation for non-residents can be carried out in any hotel, at their own expense. The full address of where the passenger will self-isolate should be included in the Health Status Declaration Form.
Local residents and people qualified as “priority attention groups” such as people over 65 years old, children and pregnant women, will be allowed to self-isolate at their homes. <br>
The Ministry of Public Health has published <a href=""https://coronavirusecuador.com/"">more information on coronavirus protocols</a> that also allows for direct messaging with the Ministry (Spanish only). <br>
If you need to find emergency accommodation to go through the mandatory self-isolation protocol, you can access options on the 
<a href=""https://www.salud.gob.ec/aislamiento-preventivo-obligatorio-apo-documentos-normativos-covid19/"">Ministry of Public Health website </a> <br>
The Government will monitor the situation in other countries with high risk of contagion to prevent incoming flights. <br>
*Travel to and from the Galapagos: Tourist activities are allowed in the Galapagos Islands. Commercial flights connecting the Islands resumed on 3 August 2020. The local authorities created a ‘safe travel corridor’ for travel to the Galapagos Islands. <br>
All travellers over 2 years old wishing to enter the Islands must present a negative Polymerase Chain Reaction (PCR) test for COVID-19, taken up to 72 hours prior to the date of the flight to the Galapagos Islands, or a full COVID-19 vaccination certificate (i.e. both doses for those vaccinations which consist of two doses, or its equivalent), received at least 14 days prior the flight date. However, the use of “Immunity Certificates or Vaccination Certificates/Cards” from foreign passengers will be subject to constant review. <br>
Any passengers presenting COVID-19 related symptoms will be denied entry to the Islands, and a Ministry of Public Health team will activate the relevant protocols. <br>
National and foreign tourists must also present evidence of a return flight, as well as the Galapagos Transit Control Card, to be filled out online at least 24 hours before the flight. There is no longer a requirement for a safe passage document (‘salvoconducto’). Travel health insurance is mandatory for foreign tourists. <br>
*Visa extensions: Foreign visitors whose visa expired between 19 March 2020 and 21 January 2021 had until 19 February 2021 to either leave the country, without paying a fine, or apply for a temporary visa, by lodging a formal application. The Ministry of Foreign Affairs and Human Mobility (MFA) implemented an online appointment system (“sistema agendamiento citas”) and immigration control officials have access to the MFA’s appointment platform to check applicants’ status. <br>
The MFA is encouraging customers not to approach their offices nationwide without a confirmed appointment (including for residence visa renewals and other services). Follow the MFA’s social media account for more information: <a href=""https://m.facebook.com/CancilleriaEcuador/""> Cancilleria Ecuador</a>. For general guidance contact: consejeria@cancilleria.gob.ec / citasvisas@cancilleriga.gob.ec / citasvisas@cancilleriga.gob.ec. Get the relevant emails for other MFA’s Coordinaciones Zonales 
<a href=""https://www.cancilleria.gob.ec/2020/06/18/coordinaciones-zonales/"">here</a>. <br>
The maximum extension period to remain in Ecuador without a formal visa is 180 days. For any general enquiries contact: 
servicios.migratorios@ministeriodegobierno.gob.ec. To apply for a visa extension (known as “prórroga”) online see <a href=""https://www.gob.ec/tramites/11237/webform"">here</a> 
<br>
<br>
 Internal Restrictions: <br> 
*Travel in Ecuador: The Ecuadorean government provides coronavirus-related information on the authorised <ahref="" https://www.coronavirusecuador.com/"">Coronavirus Ecuador website</a>. The Ministry of Public Health (MSP) also provides an authorised <ahref="" https://www.salud.gob.ec/coronavirus-covid-19/"">information page</a>. However, the most up to date information is accessible via their authorised <ahref="" https://twitter.com/salud_ec"">Twitter account</a>.
*Public spaces and services: Power to impose traffic restrictions and controls on social gatherings lies with local municipalities and other competent authorities, in conjunction with Ecuador’s National Emergency Operations Committee (COE). <br>
Please check more detailed information with local authorities – details below - to ensure that you comply with any local restrictions, including vehicle circulation restrictions in your area. <br>
The general nationwide biosecurity measures include: <br>
•        extra precaution advised for people over 60 years old, and those whose medical conditions make them vulnerable to COVID-19 <br>
•        mandatory use of face masks in public spaces. <br>
•        all individuals to comply with social distancing measures and practice frequent hand washing <br>
•        in-person school classes were suspended in 2020. However, voluntary blended classes (mix of in-person and online) have been progressively allowed to take place, since 7 June 2021, if the school’s COVID action plan has been properly approved by the National Emergency Operations Committee (COE) <br>
•        remote working continues to be encouraged <br>
•        public gatherings and mass events are prohibited <br>
•        the reopening of beaches will continue to be monitored via the “Distancia2” app. <br>
•        authorised <a href="" http://www.calidadsalud.gob.ec/laboratorios-autorizados/"">labs to undertake COVID-19 tests </a>  <br>
•        a nationwide tracing app ( ̔ASI Ecuador̕ ) is available to alert people if they have been in contact with a confirmed COVID-19 case during the last 15 days. The app is supported via Bluetooth and maintains the confidentiality of users <br>
•        the land border with Peru remains closed until further notice. However, Ecuadorean nationals and foreign residents may be allowed to enter Ecuador via the Rumichaca and Huaquillas northern and southern borders <br>
•        the land border with Colombia (Rumichaca) will be opened on 1 December 2021 to all travellers <br>
•        most ports remain closed for travel/tourism activities. Only cargo services are allowed. As of October 2021, international cruise ship operations are permitted in Esmeraldas, Guayaquil, Manta and Puerto Baquerizo ports <br>
There are no longer lockdown and weekend curfew measures in place. <br>
On 29 June, Ecuador’s National Emergency Operations Committee (COE) announced a progressive and safe return plan for face-to-face working activities. Likewise, as of 1 July, public sector employees are authorised to return to in-person office work 14 days after the final dose of their COVID-19 vaccination. On 18 October, COE announced that the previous prohibition of all mass social events will be lifted, to start as of 30 October with a maximum capacity of 60%. <br>
On 25 October, the COE encouraged local governments to implement additional restrictions nationwide as follows: <br>
•        maximum public attendance capacity of 50% in commercial establishments and 75% at outdoor events will remain in force <br>
•        increased transport frequencies to avoid crowds <br>
•        public transport and school buses at 75% capacity <br>
•        inter provincial buses and tour transport can operate at 100% capacity <br>
•        70% capacity for in-person office work <br>
•        airports’ capacity increase at public areas (75%) and at arrival and pre-embarking gates (100%) <br>
•        local governments to control and regulate the consumption of alcohol in public spaces <br>
•        limited capacity on beaches and opening hours <br>
The power to impose further restrictions, including curfew hours, transit and other controls on social gatherings lies with local municipalities and other competent authorities, in conjunction with Ecuador’s National Emergency Operations Committee (COE). <br>
Please check more detailed information with local authorities – details below - to ensure that you comply with any local restrictions, including vehicle circulation restrictions in your area. <br>
Restrictions do not apply for key sectors such as public and private healthcare, security, basic public services, emergency response, produce sectors and those who need to transport goods and food. People who are transporting passengers to/from the airport (showing flight tickets) and verified medical emergencies and appointments are also exempt. <br>
*Restrictions: The central government´s “red, amber, green” alert system is no longer in force. However, it will be used as an internal management tool for epidemiological monitoring. <br>
Each municipal government is responsible for determining its own specific restrictions including, but not limited to, maximum capacity for public transport, the circulation of private vehicles against licence plate numbers, health prevention protocols for all businesses and industries and alcohol sale and consumption. <br>
We strongly recommend that you follow the local municipalities’ social media channels to obtain the most up to date notifications, but bear in mind that these might change at any time: <br>
Quito: @MunicipioQuito; Guayaquil: @alcaldiagye; Cuenca: @MunicipioCuenca; Galapagos: @CGGalapagos <br>
Ecuador’s National Emergency Operations Committee (COE) has a website with their <a href="" https://www.gestionderiesgos.gob.ec/resoluciones-coe/"">official resolutions</a>(Spanish only).
Within the national health emergency, the Ecuadorean Ministry of Health will continue to issue the required health prevention measures, including PCR tests and any mandatory self-isolation (Aislamiento Preventivo Obligatorio – APO) requirements.
*Restrictions in Quito: Quito Municipality continues with its campaign to increase testing and triage. In addition to adhering to the standard general biosecurity measures, you must also carry an identity card at all times. <br>
All COVID-19 measures will continue to be enforced robustly and infringements will be handled by the relevant competent authorities. <br>
The “Hoy No Circula” circulation private vehicle restriction system is no longer in place; the former “Pico y Placa” system was reinstated from 4 November 2021. <br>
Vehicles with number plates ending in the following numbers will have restrictions on the given days below, and will be allowed to circulate between 10am and 3pm on those days: Monday: 0, 1; Tuesday: 2, 3; Wednesday 4, 5; Thursday 6, 7 and Friday 8, 9. <br>
All vehicle number plates are allowed to circulate all day at the weekends and on official public holidays. <br>
<a href="" https://secretariademovilidad.quito.gob.ec/index.php/hoy-no-circula-2021"">Special safe passage documents</a> (“salvoconductos”) are not applicable for “Pico y Placa”. However, “Pico y Placa” does not apply to over 65 year-olds who drive their own vehicle. <br>
All public and social gatherings are prohibited. Pubs and nightclubs are closed until further notice. All sport activities that cannot comply with the minimum distancing requirements are also suspended temporarily. <br>
All public and social gatherings are prohibited. Pubs and nightclubs are closed until further notice. All sport activities that cannot comply with the minimum distancing requirements are also suspended temporarily. You will be fined 50% of a minimum salary if you are found drinking in public spaces (including inside vehicles). <br>
Public transport, bus terminals and tourist transport can operate at a maximum of 50% capacity. As of 26 July, shopping centres, banks, cinemas, theatres, restaurants, gyms (complying with minimum distancing requirements) and entertainment centres can operate at a maximum capacity of 50%. Outdoor academic events can be held at 70% capacity. <br>
Visit the <a href="" https://www.aeropuertoquito.aero/en/covid-19-protocol.html"">Quito “Mariscal Sucre” International Airport website</a>  for details on their COVID-19 protocols and health measures for passengers.
Visit the <a href="" http://www.tagsa.aero/en_aeropuertojjo.html"">Guayaquil “Jose Joaquin de Olmedo” International Airport website  </a> for general information on COVID-19 measures and related <a href="" http://www.tagsa.aero/preguntas-covid.html"">FAQ </a> (in Spanish).
","<a href=""https://www.gov.uk/foreign-travel-advice/ecuador"">Foreign travel advice, Gov.UK</a>/ 
  <a href=""https://ec.usembassy.gov/covid-19-information-ecu-2/"">US State Dept. COVID-19 Country Specific Information</a>/ 
  <a href=""https://www.osac.gov/Content/Browse/Report?subContentTypes=Alerts%2CTravel%20Advisories"">OSAC Travel Advisories</a>/
  <a href=""https://www.salud.gob.ec/coronavirus-covid-19/"">Ministry of Health</a>/"
