20220224,"COVID-19 negative certification required for entering the country. 
Travellers arriving to Hong Kong will need to provide a negative nucleic acid test result for COVID-19, taken no more than 48 hours prior to their departure. The Hong Kong Government has specified that this must be a polymerase chain reaction (PCR) based nucleic acid test.<br>
Transit passengers travelling through Hong Kong International Airport from anywhere other than mainland China, must provide a negative nucleic acid test result for COVID-19, taken no more than 48 hours prior to their departure. The Hong Kong SAR Government has specified that this must be a polymerase chain reaction (PCR) based nucleic acid test. Other types of test such as the reverse transcription loop-mediated isothermal amplification (RT- LAMP) will not be accepted. <br>","Quarantine requirement at government designated site or self-isolation at home.
<br>
There is a risk when transiting that you will be placed into isolation in hospital in Hong Kong or 14 days government quarantine. <br>
Travellers who have visited the UK (or 7 other designated countries) within the past 21 days are not currently permitted to enter Hong Kong or transit through Hong Kong International Airport. From 5 February, this period will be shortened to 14 days. You should  <a href=""https://www.coronavirus.gov.hk./"">visit the Hong Kong SAR Government website</a> for further details. <br>
From 5 February, travellers arriving at Hong Kong International Airport from all places other than mainland China, Macao and Taiwan will need to undergo 14 days quarantine at a designated quarantine hotel. On arrival, travellers will need to provide confirmation of a hotel room reservation at their designated quarantine hotel. You can find further details on the <a href=""https://www.coronavirus.gov.hk/eng/inbound-travel.html"">Hong Kong SAR government website</a>. <br>
All travellers ending their journey at Hong Kong International Airport will have to undergo a PCR test for coronavirus. Travellers will be required to remain at the airport whilst awaiting test results which can take a number of hours. Further information is available on the <a href=""https://www.chp.gov.hk/files/pdf/holding_centre_en.pdf"">Centre for Health Protection’s website</a>. <br>
If you test positive, the Hong Kong authorities will arrange for admission to a public hospital where will remain in isolation for at least 10 days. If you are deemed to be a contact of a positive case, you will be placed in a Hong Kong government quarantine centre for 14 days. All arrivals including those who test negative for coronavirus need to undergo 14-day compulsory quarantine in a designated hotel, or the Hong Kong SAR Government’s Penny’s Bay Quarantine Centre in some cases.<br> All travellers ending their journey at Hong Kong International Airport will have to undergo a PCR test for coronavirus. Travellers will be required to remain at the airport whilst awaiting test results which can take a number of hours. Further information is available on the <a href=""https://www.chp.gov.hk/files/pdf/holding_centre_en.pdf"">Centre for Health Protection’s website</a>. <br>
If you test positive, the Hong Kong authorities will arrange for admission to a public hospital where will remain in isolation for at least 10 days. If you are deemed to be a contact of a positive case, you will be placed in a Hong Kong government quarantine centre for 14 days. All arrivals including those who test negative for coronavirus need to undergo 14-day compulsory quarantine in a designated hotel, or the Hong Kong SAR Government’s Penny’s Bay Quarantine Centre in some cases.<br>
For quarantine arrangements in Hong Kong: <br>
•        you are not allowed to leave your designated quarantine location/room for 14 days. This means you’re also unable to leave Hong Kong for the duration of the quarantine<br>
•        if you are allocated a government quarantine centre, you may be asked to contribute around HK$200 per night towards the cost<br>
•        items that can be taken in to government quarantine are restricted. There is no smoking allowed and no alcohol. Depending on your centre, facilities may be basic: there may be no fridge and no air-conditioning<br>
Arrivals from mainland China, Taiwan and Macao must quarantine at home or in a hotel for 7 - 14 days.
","Demonstrating your COVID-19 vaccination status: the Hong Kong SAR Government will accept your national health service app or your letter national health service to demonstrate your COVID-19 vaccination status. You should not use your vaccine appointment card to demonstrate your vaccine status.
Proof of a single dose of the BioNTech vaccination will be accepted for 12-17 year-old Hong Kong residents travelling from the UK, or those unable to receive a second vaccination for health reasons. Accompanied unvaccinated minors under the age of 12 who are Hong Kong residents or children of Hong Kong residents are also allowed to enter Hong Kong. All other persons who have visited ‘high risk places’ in the past 21 days will be denied entry to Hong Kong.<br>","Latest News:  Hong Kong's government extends ban on inbound flights from eight countries until 4 March, adds flights from Nepal to ban list because of COVID-19 (Reuters, 11.02.2022).
 <br>
 <br>
 International Restrictions:<br> 
*Entry to Hong Kong: Travellers who have visited the UK (or 7 other designated countries) within the past 21 days are not currently permitted to enter Hong Kong or transit through Hong Kong International Airport. From 5 February, this period will be shortened to 14 days. You should  <a href=""https://www.coronavirus.gov.hk./"">visit the Hong Kong SAR Government website</a> for further details. <br>
From 5 February, travellers arriving at Hong Kong International Airport from all places other than mainland China, Macao and Taiwan will need to undergo 14 days quarantine at a designated quarantine hotel. On arrival, travellers will need to provide confirmation of a hotel room reservation at their designated quarantine hotel. You can find further details on the <a href=""https://www.coronavirus.gov.hk/eng/inbound-travel.html"">Hong Kong SAR government website</a>. <br>
Most travellers arriving from abroad must be fully vaccinated Hong Kong residents. Proof of a single dose of the BioNTech vaccination will be accepted for 12-17 year-old Hong Kong residents travelling from abroad, or those unable to receive a second vaccination for health reasons. Accompanied unvaccinated minors under the age of 12 who are Hong Kong residents or children of Hong Kong residents are also allowed to enter Hong Kong. <br>
Travellers arriving to Hong Kong will need to provide a negative nucleic acid test result for COVID-19, taken no more than 48 hours prior to their departure. The Hong Kong Government has specified that this must be a polymerase chain reaction (PCR) based nucleic acid test. Other types of tests such as the reverse transcription loop-mediated isothermal amplification (RT- LAMP) will not be accepted and do not fulfil the relevant boarding requirement. You will need a separate certificate confirming that the testing laboratory meets the required standards. <br>
You should <a href=""https://www.coronavirus.gov.hk/eng/high-risk-places.html"">check the Hong Kong SAR government’s website</a>
 for important details about the documents required and <a href=""https://www.coronavirus.gov.hk/eng/designated-hotel-list.html"">check the Hong Kong SAR government’s list of designated hotels when you make your booking</a>. You must take designated transport, which is provided by the government, from the airport to your hotel. <br>
*At the airport: All passengers, whether departing, arriving or transferring/transiting need to wear facemasks in all passenger accessible areas of Hong Kong International Airport. You can find further details on the <a href=""https://www.coronavirus.gov.hk/eng/inbound-travel.html"">Hong Kong SAR government website</a>. <br>
*Demonstrating your COVID-19 status: Hong Kong will accept proof of COVID-19 recovery and vaccination record and proof of COVID-19 vaccination issued in the Crown Dependencies. Your last vaccine dose must have been administered at least 14 days prior to travel. Your appointment card from vaccination centres is not designed to be used as proof of vaccination and should not be used to demonstrate your vaccine status. <br>
*Health declaration form: All inbound travellers via Hong Kong International Airport need to submit a health declaration form. <br>
*Testing on arrival: All travellers ending their journey at Hong Kong International Airport will have to undergo a PCR test for coronavirus. Travellers will be required to remain at the airport whilst awaiting test results which can take a number of hours. Further information is available on the <a href=""https://www.chp.gov.hk/files/pdf/holding_centre_en.pdf"">Centre for Health Protection’s website</a>. <br>
If you test positive, the Hong Kong authorities will arrange for admission to a public hospital where will remain in isolation for at least 10 days. If you are deemed to be a contact of a positive case, you will be placed in a Hong Kong government quarantine centre for 14 days. All arrivals including those who test negative for coronavirus need to undergo 14-day compulsory quarantine in a designated hotel, or the Hong Kong SAR Government’s Penny’s Bay Quarantine Centre in some cases. See “Quarantine requirements” below. <br>
You may be separated from your child if one of you tests positive for coronavirus. If this happens to you, you can call +(852) 2901 3000 for 24/7 urgent consular assistance. <br>
*Quarantine requirements: Quarantine following travel is mostly spent at either the Hong Kong SAR Government’s Penny’s Bay Quarantine Centre, or a <a href=""https://www.coronavirus.gov.hk/eng/designated-hotel-list.html"">designated hotel</a>. <br>
Family members of someone who tests positive, or those who have been in contact with a positive case, will be placed in a government quarantine centre. <br>
Children travelling alone will also need to quarantine for 14 days on arrival in a designated hotel. It is down to hotel policy whether a child can self-isolate alone. Further details can be found on the Hong Kong SAR government’s website and you should call the Port Heath Division (+852 3904 9333) to understand the latest requirements if your child is travelling alone. <br>
For up-to-date advice on entry requirements and restrictions, please visit the <a href=""https://www.coronavirus.gov.hk/eng/inbound-travel.html"">Hong Kong SAR government’s website</a><br>
For quarantine arrangements in Hong Kong: <br>
•        you are not allowed to leave your designated quarantine location/room for 14 days. This means you’re also unable to leave Hong Kong for the duration of the quarantine<br>
•        if you are allocated a government quarantine centre, you may be asked to contribute around HK$200 per night towards the cost<br>
•        items that can be taken in to government quarantine are restricted. There is no smoking allowed and no alcohol. Depending on your centre, facilities may be basic: there may be no fridge and no air-conditioning<br>
Failure to comply with the quarantine conditions may result in you being immediately taken to government quarantine facilities. You could face a 6-month prison sentence and a substantial fine. You should comply with the requirements of your quarantine arrangements. <br>
See the <a href=""https://www.coronavirus.gov.hk/eng/inbound-travel.html"">Hong Kong government coronavirus website</a> for further information. <br>
*Transiting Hong Kong: Transit services at Hong Kong International Airport are currently suspended for anyone who has visited a ‘High-risk’ country within the past 14 days. A list of ‘High-risk’ countries can be found on the <a href=""https://www.coronavirus.gov.hk/eng/inbound-travel.html"">Hong Kong SAR Government’s website</a>. <br>
Transiting through Hong Kong from, but not to, mainland China is now allowed. You should check with your travel agent or airline before travelling and check the <a href=""https://www.hongkongairport.com/en/important-notice/index.page?noticeid=1523424631510-3"">Hong Kong International Airport website</a>. <br>
Transit passengers travelling through Hong Kong International Airport from anywhere other than mainland China, must provide a negative nucleic acid test result for COVID-19, taken no more than 48 hours prior to their departure. The Hong Kong SAR Government has specified that this must be a polymerase chain reaction (PCR) based nucleic acid test. Other types of test such as the reverse transcription loop-mediated isothermal amplification (RT- LAMP) will not be accepted. <br>
There is a risk when transiting that you will be placed into isolation in hospital in Hong Kong or 14 days government quarantine. All passengers transiting Hong Kong International Airport will be subject to advanced screening measures, including temperature checks. Passengers deemed to have a high temperature will undergo further checks by the Port Health Office at the airport. If you meet further risk criteria, you will be transferred to a Hong Kong public hospital for mandatory checks/treatment, where it is highly likely you will be asked to complete a mandatory COVID-19 test. If you successfully pass health screening you need to sit in designated areas at boarding gates and use designated queues in dining facilities and shops, in line with Hong Kong International Airport anti-virus measures. <br>
*Travel between Hong Kong, Macao and mainland China: All border crossings with mainland China remain closed indefinitely, with the exception of the Shenzhen Bay Checkpoint and the Hong Kong-Zhuhai-Macao Bridge. All passengers wanting to board a shuttle bus to cross the bridge departing from Hong Kong to Macao must present a certificate confirming that they have tested negative for COVID-19 within 72 hours of their departure. The special ferry service between Taipa Ferry Terminal in Macao and Hong Kong International Airport has now ceased operations. All ferry crossings between Hong Kong and mainland China are currently not in operation with the exception of the service from Shenzhen Shekou Port to Hong Kong International Airport. Kai Tak Cruise and Ocean Terminals are also closed to passengers indefinitely. <br>
Arrivals from mainland China, Taiwan and Macao must quarantine at home or in a hotel for 7 - 14 days. Certain groups of people travelling from mainland China, Taiwan and Macao may be granted an exemption from quarantine requirements by applying in advance to the Chief Secretary of the Administration. <br>
Hong Kong residents in mainland China may be eligible for the Return2hk scheme, which enables quarantine free travel from mainland China to Hong Kong. Non-residents in mainland China may be eligible for the Come2hk scheme, which offers similar exemptions to entry requirements. You can find further information on the <a href=""https://www.coronavirus.gov.hk/eng/return2hk-scheme.html"">Hong Kong SAR government coronavirus website</a>. <br>
During your quarantine period, the location of your mobile phone will be tracked, and you will be contacted if you leave the place where you are quarantining. <br>
  <br>
  <br>
Internal restrictions: <br>
*Travel in Hong Kong: There are local travel restrictions in place upon arrival in Hong Kong including mandatory quarantine. <br>
Following the detection of the Omicron Covid-19 variant in Hong Kong, restrictions have been placed on the operations of restaurants, bars, schools, museums and a number of other public places. Further details can be found on the <a href=""https://www.gov.hk/en/nonresidents/"">Hong Kong SAR Government’s website</a> 
Use of the Hong Kong SAR Government’s LeaveHomeSafe contact tracing application is mandatory for those visiting Government premises and a number of entertainment venues, including cinemas, restaurants and theme parks.Further details can be found on the [LeaveHomeSafe website] <ahref=""https://www.leavehomesafe.gov.hk/en/"">https://www.leavehomesafe.gov.hk/en/</a>. <br>
From 24 February, proof of vaccination against COVID-19 will be required to enter a range of venues, including restaurants, gyms, swimming pools and hotels. Those who are under 12, or deemed medically unfit for vaccination, will be exempt from these requirements. Further details can be found on the <a href=""https://www.gov.hk/en/nonresidents/"">Hong Kong SAR Government’s website </a>
It is possible that you may be mandatorily tested and/or placed in a government quarantine centre, if you are identified as a contact of someone who has tested positive for coronavirus. <br>
The Hong Kong Government has announced that from mid-March all residents will be subject to a compulsory universal testing programme for COVID-19. Further details can be found on the <a href=""https://www.gov.hk/en/nonresidents/"">Hong Kong SAR Government’s website </a>.
*Public spaces and services: Public gatherings have been restricted to a maximum of 2 people (members of the same household are exempt). <br>
The government has also introduced a mandatory requirement to wear face masks in all public spaces, including on public transport. Failure to comply may result in a fine of up to 5000 HKD. <br>
For up to date information, you should follow the <ahref=""https://www.coronavirus.gov.hk/eng/social_distancing-faq.htm"">guidance from the Hong Kong authorities</a>.
*If you test positive for COVID-19, you may need to stay where you are until you test negative. You may also need to seek treatment there.



","<a href=""https://www.gov.uk/foreign-travel-advice/hong-kong"">Foreign travel advice, Gov.UK</a>/ 
  <a href=""https://www.osac.gov/Content/Browse/Report?subContentTypes=Alerts%2CTravel%20Advisories"">OSAC Travel Advisories</a>/ 
  <a href=""https://hk.usconsulate.gov/covid-19-information/"">US State Dept. COVID-19 Country Specific Information</a>/
 <a href=""https://www.gov.hk/en/residents/"">HK Gov</a>/"
