20220107,"COVID-19 negative certification required.  <br>
Passengers arriving from the countries that are in the list of countries to which special epidemiological measures apply when they are crossing the border of the Republic of Croatia, and which are published on the website of the Croatian Institute of Public Health, are obliged to present, depending on the category of the country:<br>
- a negative PCR test result not older than 48 hours and they have to stay in mandatory self-isolation for 14 days (Republic of South Africa, Zanzibar (Tanzania), Brazil), or<br>
- a negative PCR test result not older than 72 hours or a negative rapid antigen test result not older than 48 hours, regardless of their vaccination status and recovery (Brazil)<br> 
All travellers aged above 12 arriving from third countries, including citizens of EU Member States and Schengen Associated Countries, as well as members of their families and third-country nationals who are long-term residents or entitled to reside under other EU directives or national laws, can enter Croatia without being subject to any isolation or testing requirement in the following cases:<br>
- Vaccination certificate; Accepted vaccines: Pfizer, Moderna, AstraZeneca, Johnson&Johnson, Gamaleya, Sinopharm <br> 
the proof of vaccination is valid at the following conditions: <br> 
  - from the day of the second dose, or from 14 days after the single dose for the Johnson&Johnson vaccine. Validity: 365 days; <br> 
  - after one dose of any accepted vaccine, for people who have recovered from COVID-19 within twelve months from contracting the disease. Validity: 365 days. <br> 
  - between 22 and 42 days from the first dose of the Pfizer, Moderna or Gamaleya vaccine<br> 
  - between 22 and 84 days from the first dose of the AstraZeneca vaccine<br> 
  - Certificate showing that they have recovered from COVID-19 and have received one dose of vaccine within twelve months from contracting the disease, provided that the vaccine was administered less than 365 daysfrom their arrival at the border crossing point<br> 
  - Positive PCR test result or rapid antigen test result, confirming that the holder recovered from the SARS-CoV-2 virus infection, which was performed in the previous 365 days and which is older than 11 days from the date of arrival at the border crossing point, or  a medical certificate of recovery; <br> 
  - Negative result to a COVID-19 test.<br> 
  - Both PCR and Rapid Antigen tests (RAT) are accepted.<br> 
  - Validity: PCR test results must not be older than 72 hours, RAT test results must not be older than 48 hours. The RAT test must be listed in the Common list of rapid antigen tests recognized by the Member States of the European Union. If the RAT test is carried out abroad, the manufacturer and/or the commercial name of the test must be visible and the test must be issued by a health institution/laboratory and signed/confirmed by a doctor.<br> 
  - PCR test or Rapid Antigen Test upon arrival in (at their own expense), with the obligation to stay in self-isolation until the arrival of the negative result. If testing cannot be performed, a 10-day quarantine is imposed.
 ","Self-isolation at own accommodation- subject to PCR.
Passengers arriving from the countries that are in the list of countries to which special epidemiological measures apply when they are crossing the border of the Republic of Croatia, and which are published on the website of the Croatian Institute of Public Health, are obliged to present, depending on the category of the country:<br>
- a negative PCR test result not older than 48 hours and they have to stay in mandatory self-isolation for 14 days (Republic of South Africa, Zanzibar (Tanzania), Brazil), or<br>
- a negative PCR test result not older than 72 hours or a negative rapid antigen test result not older than 48 hours, regardless of their vaccination status and recovery (Brazil)<br>
This provision also refers to countries and/or regions of Schengen Member States and Schengen associated countries which are on the red or dark red list of the European Centre for Disease Prevention and Control if the Croatian Institute of Public Health listed them as countries to which special epidemiological measures apply.<br>
The duration of self-isolation may be shortened for passengers arriving from the countries for which quarantine is mandatory if they take a PCR test for SARS-CoV-2 at their own expense at an institution authorised for testing no sooner than the seventh day of self-isolation, and the test result comes back negative.<br>
*PCR test or Rapid Antigen Test upon arrival in (at their own expense), with the obligation to stay in self-isolation until the arrival of the negative result. If testing cannot be performed, a 10-day quarantine is imposed.

","THIS COUNTRY IS ALREADY CONNECTED TO THE GATEWAY AND IS ISSUING AND/OR VERIFYING AT LEAST ONE EU DIGITAL COVID CERTIFICATE (VACCINATION, RECOVERY, TEST) <br>
Accepted vaccines: Pfizer, Moderna, AstraZeneca, Johnson&Johnson, Gamaleya, Sinopharm","Latest News: 
  <br>
  <br>
International Restrictions:<br>
*From within the EU: <p><strong>All travellers arriving from the countries of the European Union or from a Schengen Associated Country, who do not yet hold an EU Digital COVID Certificate, will be allowed entry into the Republic of Croatia, if they have one of the following:</strong></p><ul><li><strong>Vaccination certificate</strong>;<br />Accepted vaccines: <em>Pfizer, Moderna, AstraZeneca, Johnson&amp;Johnson, Gamaleya, Sinopharm</em><br /><br />the proof of vaccination is valid at the following conditions:</li></ul><ul><ul><li><strong>from the day of the second dose</strong>, or from 14 days after the single dose for the Johnson&amp;Johnson vaccine. Validity: <strong>365 days</strong>;</li><li><strong>after one dose of any accepted vaccine</strong>, for people who have recovered from COVID-19 within twelve months from contracting the disease. Validity: <strong>365 days</strong>.</li><li><strong>between 22 and 42 days from the first dose</strong> of the Pfizer, Moderna or Gamaleya vaccine</li><li><strong>between 22 and 84 days from the first dose</strong> of the AstraZeneca vaccine</li></ul></ul><ul><li><strong>Certificate showing that they have recovered from COVID-19 and have received one dose of vaccine within eight months from contracting the disease, provided that the vaccine was administered less than 365 days from their arrival at the border crossing point; </strong></li></ul><ul><li><strong>Positive PCR test result or rapid antigen test result, confirming that the holder recovered from the SARS-CoV-2 virus infection, which was performed in the previous 365 days and which is older than 11 days from the date of arrival at the border crossing point, or&nbsp; a medical certificate of recovery;</strong></li></ul><ul><li>Negative result to a <strong>COVID-19 test</strong>.<strong><br /></strong>Both <strong>PCR and </strong><a href=""https://mup.gov.hr/uzg-covid/english/286212#BAT""><strong>Rapid Antigen tests (RAT)</strong></a> are accepted.<br />Validity: PCR test results must not be older than<strong> 72 hours</strong>, RAT test results must not be older than<strong> 48 hours</strong>. The RAT test must be listed in the<a href=""https://ec.europa.eu/health/sites/health/files/preparedness_response/docs/covid-19_rat_common-list_en.pdf""><strong>Common list of rapid antigen tests recognized by the Member States of the European Union.&nbsp;</strong></a>If the RAT test is carried out abroad, the manufacturer and/or the commercial name of the test must be visible and the test must be issued by a health institution/laboratory and signed/confirmed by a doctor.</li><li><strong>PCR test or&nbsp;</strong><a href=""https://mup.gov.hr/uzg-covid/english/286212#BAT""><strong>Rapid Antigen Test</strong></a><strong>&nbsp;upon arrival&nbsp;</strong>in (at their own expense), with the obligation to stay in self-isolation until the arrival of the negative result. If testing cannot be performed, a&nbsp;<strong>10-day quarantine</strong>&nbsp;is imposed.</li></ul><p>Passengers arriving from the <a href=""https://www.hzjz.hr/wp-content/uploads/2020/03/Popis-dr%C5%BEava-za-koje-se-pri-dolasku-u-Republiku-Hrvatsku-primjenjuju-posebne-epidemiolo%C5%A1ke-mjere-prilikom-prelaska-granice.pdf"">countries subject to special epidemiological measures</a>&nbsp;are obliged to present, depending on the category of the country:</p><ul><li>a <strong>negative PCR test</strong> <strong>result</strong> not older than <strong>48 hours</strong> and they have to stay in mandatory <strong>self-isolation for 14 days</strong> (Republic of South Africa, Zanzibar (Tanzania), Brazil), or</li><li>a <strong>negative PCR test result</strong> not older than <strong>72 hours</strong> or a negative rapid antigen test result not older than <strong>48 hours</strong>, regardless of their vaccination status and recovery (Great Britain, Cyprus, Russian Federation, India).This provision also refers to countries and/or regions of Schengen Member States and Schengen associated countries which are on the red or dark red list of the European Centre for Disease Prevention and Control if the Croatian Institute of Public Health listed them as countries to which special epidemiological measures apply.</li></ul><p>The duration of self-isolation may be shortened for passengers arriving from the countries for which quarantine is mandatory if they take a PCR test for SARS-CoV-2 at their own expense at an institution authorised for testing no sooner than the seventh day of self-isolation, and the test result comes back negative.</p><p></p><p><strong>The following categories are exempt from possessing a valid EU Digital COVID Certificate or from the abovementioned obligations:</strong></p><ul><li>children under 12 years old travelling with their parents/guardians if their parents/guardians have a valid EU Digital COVID certificate</li><li>workers or self-employed persons performing essential tasks, including healthcare workers, frontier and posted workers and seasonal workers as specified in the <a href=""https://mup.gov.hr/UserDocsImages/dokumenti/2020/COVID-19%20smjernice/CELEX_52020XC0330(03)_HR_TXT.pdf"" data-fileid=""132753"">Guidelines concerning&nbsp; the exercise of the free movement of workers during COVID-19 outbreak</a>;</li><li>pupils, students and interns</li><li>seafarers and workers in the transport sector or transport service providers, including heavy goods vehicle drivers transporting goods to be used in the national territory and those in transit only;</li><ul><li>The provisions regarding frontier workers apply adequately to other categories of passengers who, due to the nature of their job or occupation, need to cross the state border frequently (e.g. athletes playing for clubs in a neighbouring country).</li></ul><li>diplomats, staff of international organizations and persons invited by international organizations and whose physical presence is necessary for the functioning of those organizations, military personnel and police officers, as well as humanitarian and civil protection personnel in the performance of their duties;</li><li>persons traveling for family or business reasons, including journalists in the performance of their duties;</li><li>passengers in transit with the obligation to leave the Republic of Croatia within 12 hours from entry;</li><li>patients traveling for health reasons.</li></ul><p>Passengers who represent one of the previously mentioned exceptions are obliged to present credible documentation upon entering the Republic of Croatia in order to prove the reasons for the exemption.</p><p><strong>Find out more:</strong></p><p><strong><br /></strong><a href=""https://mup.gov.hr/uzg-covid/english/286212"">Conditions of entry into the Republic of Croatia</a><br /><a href=""https://www.koronavirus.hr/en"">koronavirus.hr</a></p><br/><a href=""https://europa.eu/youreurope/citizens/travel/entry-exit/index_en.htm"">Documents you need to travel in Europe</a><br><a href=""https://europa.eu/youreurope/citizens/health/unplanned-healthcare/temporary-stays/index_en.htm"">Health cover for temporary stays</a>
<br><br>
*Transit: <p><em>Provisional information subject to further revision and confirmation from National Authorities</em></p><p>Holders of EUDCC can enter Croatia without being subject to further restrictions (testing or quarantine), at the condition that their certificate contains either:</p><ul><li><strong>Vaccination certificate</strong>;<br />Accepted vaccines:&nbsp;<em>Pfizer, Moderna, AstraZeneca, Johnson&amp;Johnson, Gamaleya, Sinopharm </em><br /><br />the proof of vaccination is valid at the following conditions:</li><li><strong>from the day of the second dose</strong>, or from 14 days after the single dose for the Johnson&amp;Johnson vaccine. Validity:&nbsp;<strong>365 days</strong>;</li><li><strong>after one dose of any accepted vaccine</strong>, for people who have recovered from COVID-19 within twelve months from contracting the disease. Validity:&nbsp;<strong>365 days</strong>.</li><li><strong>between 22 and 42 days from the first dose</strong>&nbsp;of the Pfizer, Moderna or Gamaleya vaccine</li><li><strong>between 22 and 84 days from the first dose</strong>&nbsp;of the AstraZeneca vaccine</li><li><strong>Certificate showing that they have recovered from COVID-19 and have received one dose of vaccine within twelve months from contracting the disease, provided that the vaccine was administered less than 365 days from their arrival at the border crossing point;&nbsp; </strong></li><li><strong>Positive PCR test result or rapid antigen test result, confirming that the holder recovered from the SARS-CoV-2 virus infection, which was performed in the previous 365 days and which is older than 11 days from the date of arrival at the border crossing point, or&nbsp; a medical certificate of recovery;</strong></li><li>Negative result to a&nbsp;<strong>COVID-19 test</strong>.<strong><br /></strong>Both&nbsp;<strong>PCR and&nbsp;</strong><a href=""https://mup.gov.hr/uzg-covid/english/286212#BAT""><strong>Rapid Antigen tests (RAT)</strong></a>&nbsp;are accepted.<br />Validity: PCR test results must not be older than<strong>&nbsp;72 hours</strong>, RAT test results must not be older than<strong>&nbsp;48 hours</strong>. The RAT test must be listed in the <a href=""https://ec.europa.eu/health/sites/health/files/preparedness_response/docs/covid-19_rat_common-list_en.pdf""><strong>Common list of rapid antigen tests recognized by the Member States of the European Union.&nbsp;</strong></a>If the RAT test is carried out abroad, the manufacturer and/or the commercial name of the test must be visible and the test must be issued by a health institution/laboratory and signed/confirmed by a doctor.</li><li><strong>PCR test or&nbsp;</strong><a href=""https://mup.gov.hr/uzg-covid/english/286212#BAT""><strong>Rapid Antigen Test</strong></a><strong>&nbsp;upon arrival&nbsp;</strong>in (at their own expense), with the obligation to stay in self-isolation until the arrival of the negative result. If testing cannot be performed, a&nbsp;<strong>10-day quarantine</strong>&nbsp;is imposed.<p>Children&nbsp;<strong>under 12 years old</strong>&nbsp;travelling with their parents/guardians are exempt from the obligation to present a negative PCR test result and to self-isolate if their parents/guardians have a valid EU Digital COVID certificate, or a negative PCR or rapid antigen test result, or a certificate of vaccination or recovery from COVID-19.</p></li></ul>
<br><br>
*From Third Countries: <p>Third-country nationals who are not family members of nationals of EU Member States or Schengen Associated Countries, nor are long-term residents or persons who have the right to reside under EU directives or national law or who have national long-term visas, are allowed entry into the Republic of Croatia <b>only in case of necessary travel.</b></p><p>Passengers (regardless of their citizenship) coming from countries covered by the currently valid amendments to <a href=""https://eur-lex.europa.eu/legal-content/HR/TXT/PDF/?uri=CELEX:32021H0992&amp;from=HR"" target=""_blank"">COUNCIL RECOMMENDATION (EU) 2021/992 of 18 June 2021</a><b>, </b>can travel to the Republic of Croatia without having to prove or justify their reasons for travel if they meet the epidemiological conditions for entry into the Republic of Croatia that are prescribed for third-country nationals.</p><p>The categories of people exempted from the travel ban can be found at <a href=""https://mup.gov.hr/uzg-covid/english/286212"" target=""_blank"">mup.gov.hr</a>.</p><p>In order to be allowed to enter Croatia, travellers from third-countries are required to have one of the following: <br />- a certificate of paid accommodation in a hotel, campsite, rented vessel or another form of tourist accommodation, or they must be owners of houses or vessels in Croatia; <br />- a valid EU Digital COVID certificate.</p><p>All travellers aged above 12 arriving from third countries, including citizens of EU Member States and Schengen Associated Countries, as well as members of their families and third-country nationals who are long-term residents or entitled to reside under other EU directives or national laws, can enter Croatia without being subject to any isolation or testing requirement in the following cases:</p><ul><li><b>Vaccination certificate</b>; <br />Accepted vaccines: <i>Pfizer, Moderna, AstraZeneca, Johnson&amp;Johnson, Gamaleya, Sinopharm</i><br />the proof of vaccination is valid at the following conditions:<ul><li><b>from the day of the second dose</b>, or from 14 days after the single dose for the Johnson&amp;Johnson vaccine. Validity: <b>270 days</b>;</li><li><b>after one dose of any accepted vaccine</b>, for people who have recovered from COVID-19 within eight months from contracting the disease. Validity: <b>270 days</b>.</li><li><b>between 22 and 42 days from the first dose</b> of the Pfizer, Moderna or Gamaleya vaccine</li><li><b>between 22 and 84 days from the first dose</b> of the AstraZeneca vaccine</li></ul></li><li><b>Certificate showing that they have</b> <b>recovered from COVID-19</b> and have received one dose of vaccine within <b>eight months</b> from contracting the disease, provided that the vaccine was administered less than <b>270 days</b> from their arrival at the border crossing point;</li><li><b>Positive PCR test result or rapid antigen test result</b>, confirming that the holder recovered from the SARS-CoV-2 virus infection, which was performed in the previous <b>270 days</b> and which is older than <b>11 days</b> from the date of arrival at the border crossing point, or a medical certificate of recovery;</li><li>Negative result to a <b>COVID-19 test</b>. <br />Both <b>PCR and </b><a href=""https://mup.gov.hr/uzg-covid/english/286212#BAT"" target=""_blank""><b>Rapid Antigen tests (RAT)</b></a> are accepted. <br />Validity: PCR test results must not be older than<b> 72 hours</b>, RAT test results must not be older than<b> 48 hours</b>. The RAT test must be listed in the <a href=""https://ec.europa.eu/health/sites/health/files/preparedness_response/docs/covid-19_rat_common-list_en.pdf"" target=""_blank""><b>Common list of rapid antigen tests recognized by the Member States of the European Union. </b></a>If the RAT test is carried out abroad, the manufacturer and/or the commercial name of the test must be visible and the test must be issued by a health institution/laboratory and signed/confirmed by a doctor.</li><li><b>PCR test or </b><a href=""https://mup.gov.hr/uzg-covid/english/286212#BAT"" target=""_blank""><b>Rapid Antigen Test</b></a><b> upon arrival </b>in (at their own expense), with the obligation to stay in self-isolation until the arrival of the negative result. If testing cannot be performed, a <b>10-day quarantine</b> is imposed.</li></ul><p>Passengers arriving from the countries that are in the list of countries to which special epidemiological measures apply when they are crossing the border of the Republic of Croatia, and which are published on the website of the Croatian Institute of Public Health, are obliged to present, depending on the category of the country,</p><ul><li>a <b>negative PCR test result</b> not older than <b>48 hours</b> and they have to stay in <b>mandatory self-isolation for 14 days</b> (Republic of South Africa, Zanzibar (Tanzania), Brazil), or</li><li>a <b>negative PCR test result</b> not older than <b>72 hours</b> or a negative rapid antigen test result not older than <b>48 hours</b>, regardless of their vaccination status and recovery (Great Britain, Cyprus, Russian Federation, India).This provision also refers to countries and/or regions of Schengen Member States and Schengen associated countries which are on the red or dark red list of the European Centre for Disease Prevention and Control if the Croatian Institute of Public Health listed them as countries to which special epidemiological measures apply.</li></ul><p>The duration of self-isolation may be shortened for passengers arriving from the countries for which quarantine is mandatory if they take a PCR test for SARS-CoV-2 at their own expense at an institution authorised for testing no sooner than the seventh day of self-isolation, and the test result comes back negative. </p><p><b>Provisions for people applying for residency/work in Croatia</b></p><p>Persons who, following their application for residence/work in Croatia (including digital nomads), have received a positive decision from the competent authority, are obliged to present credible documentation upon entering Croatia to prove the reasons for their exemption to COVID-19 testing or isolation. During their stay in Croatia, they are obliged to follow the general and special recommendations and instructions of the Croatian Institute of Public Health.</p><p>Find out more: <br /><a href=""https://mup.gov.hr/aliens-281621/stay-and-work/temporary-stay-of-digital-nomads/286833"" target=""_blank"">Request for temporary stay <br /></a><a href=""https://croatia.hr/en-GB/travel-info/croatia-your-new-office"" target=""_blank"">Croatia – your new office</a></p><p>&nbsp;</p><p><b>Mandatory Travel Documentation</b></p><p>For a faster border crossing, it is recommended to fill out the form at <a href=""https://entercroatia.mup.hr/"" target=""_blank"">ENTERCROATIA</a> prior to departure.</p><p>&nbsp;</p><p><b>Find out more:</b> <br /><a href=""https://mup.gov.hr/uzg-covid/english/286212"" target=""_blank"">Conditions of entry into the Republic of Croatia <br /></a><a href=""https://www.koronavirus.hr/en"" target=""_blank"">koronavirus.hr</a></p> 
<br>
<br>
Internal Restrictions: <br>
*Travel in Croatia: There are no restrictions on regional travel within Croatia. <br>
*Face masks: It is mandatory for passengers to wear masks on public transport, taxis and in shops and other commercial premises. <br>
*Public places and services: There have been reports of a number of coronavirus cases associated with visits to bars and other busy venues. You should exercise caution and follow social distancing rules when attending busy venues. <br>
From 16 November, anyone entering public services, local and regional municipalities, state-owned companies and institutions will be required to show either a digital COVID-19 certificate or appropriate proof of vaccination, proof of recovery or a negative test. You may also be asked to show identification along with your COVID-19 pass. <br>
Croatia will accept the proof of COVID-19 recovery and vaccination record. Your appointment card from vaccination centres is not designed to be used as proof of vaccination and should not be used to demonstrate your vaccine status.
*If you test positive for COVID-19, you may need to stay where you are until you test negative. You may also need to seek treatment there.
","<a href=""https://www.gov.uk/foreign-travel-advice/croatia/entry-requirements"">Foreign travel advice, Gov.UK</a>/ 
  <a href=""https://hr.usembassy.gov/covid-19-information-2/"">US State Dept. COVID-19 Country Specific Information</a>/ 
  <a href="" https://reopen.europa.eu/en/map/HRV"">Re-open Europe</a>/
 <a href=""https://www.koronavirus.hr/"">Country Link</a>/"
