20220118,"COVID-19 negative certification required for entering the country. 

From 16 January 2022, the following conditions will apply to travellers entering Kenya: <br>
•        All passengers, irrespective of nationality and residency status, must be in possession of a valid COVID-19 negative PCR test certificate conducted within 72 hours before their travel to Kenya. Children under the age of five are exempt from this requirement, as are crew on layover <br>
•        Passengers who are aged 18 or over must have a certificate of vaccination against COVID-19. Travellers who are exempt from vaccination or who have recovered from COVID-19 in the preceding 90 days are exempt from this requirement; however, such persons must provide a letter from a medical practitioner confirming their exemption or recovery COVID-19. Some airlines may also request that foreign travellers show proof of vaccination on the App at check-in<br>
Travellers must upload their certificate of vaccination and negative PCR test certificate to <a href=""https://globalhaven.org/"">https://globalhaven.org/</a>   before boarding their flight <br>
•        COVID-19 vaccines approved by the World Health Organization (WHO) are considered valid by public health officials in Kenya. You must have received a full dose of a WHO-approved .","Quarantine requirement at government designated site- subject to category.
<br> 
  A random antigen test may be taken by port health officers on entry, depending on risk evaluation of the country of origin. Any person who tests positive will be directed to isolate at home (for Kenyan residents) or in a Ministry of Health designated facility (for non-Kenyan residents) for 10 days, at their own cost <br>
•        All passengers displaying flu-like symptoms on arrival, or who develop symptoms of COVID-19 within 14 days of arrival, may be placed into quarantine at home or at a government facility, at their own cost <br>
•        Any passengers testing positive will be required to take a PCR test and isolated awaiting results. If the PCR is positive, passengers will need to isolate for 10 days at Government of Kenya approved isolation facilities at their own cost, with a repeat PCR test on day 7 <br>
•        From 2 December, travellers arriving from or transiting through South Africa, Botswana, Zimbabwe, Malawi, Eswatini, Lesotho, Namibia, Mozambique, Zambia, Malawi, Ghana and Nigeria within the previous 14 days will undergo a free rapid antigen test on arrival for surveillance purposes <br>



","From 21 December 2021, the following conditions will apply to travellers entering Kenya:<br>

Passengers entering Kenya will also be required to show a certificate of vaccination against COVID-19, unless they have a certificate of exemption from a medical practitioner. COVID-19 vaccines approved by the World Health Organization (WHO) are considered valid by public health officials in Kenya. You must have received a full dose of a WHO-approved vaccination. Under 18s are exempt from this requirement.<br>
Covid - 19 certificate as proof of full vaccination: <br>
- Moderna: 2 doses<br>
- Pfizer: 2 doses<br>
- Astra Zeneca: 2 doses<br>
- Janssen (Johnson & Johnson): 1 dose<br>
","Latest News: 
  <br>
  <br>
 International Restrictions: <br>
Kenya Civil Aviation Authority suspends inbound flights from United Arab Emirates in response to similar ban by Dubai authorities (Capital News, 11.01.2022).<br>
*Entry to Kenya: Full details of the Government of Kenya’s entry requirements in relation to coronavirus can be found on the <a href=""https://www.kcaa.or.ke/covid-19"">Kenya Civil Aviation Authority website</a>.
From 16 January 2022, the following conditions will apply to travellers entering Kenya: <br>
•        All passengers, irrespective of nationality and residency status, must be in possession of a valid COVID-19 negative PCR test certificate conducted within 72 hours before their travel to Kenya. Children under the age of five are exempt from this requirement, as are crew on layover <br>
•        Passengers who are aged 18 or over must have a certificate of vaccination against COVID-19. Travellers who are exempt from vaccination or who have recovered from COVID-19 in the preceding 90 days are exempt from this requirement; however, such persons must provide a letter from a medical practitioner confirming their exemption or recovery COVID-19. Some airlines may also request that foreign travellers show proof of vaccination on the App at check-in<br>
Travellers must upload their certificate of vaccination and negative PCR test certificate to <a href=""https://globalhaven.org/"">https://globalhaven.org/</a>   before boarding their flight <br>
•        COVID-19 vaccines approved by the World Health Organization (WHO) are considered valid by public health officials in Kenya. You must have received a full dose of a WHO-approved vaccination. Under 18s are exempt from this requirement <br>
All passengers/crew irrespective of nationality and residency status shall be expected to fill in the travellers’ locator form and submit before travel to <a href=""http://bit.ly/covid19moh"">http://bit.ly/covid19moh</a> and thereafter submit daily health information on the Jitenge Platform / App for 14 consecutive days. For more information, please see the ‘Data Collection’ section below <br>
•        A random antigen test may be taken by port health officers on entry, depending on risk evaluation of the country of origin. Any person who tests positive will be directed to isolate at home (for Kenyan residents) or in a Ministry of Health designated facility (for non-Kenyan residents) for 10 days, at their own cost <br>
•        All passengers displaying flu-like symptoms on arrival, or who develop symptoms of COVID-19 within 14 days of arrival, may be placed into quarantine at home or at a government facility, at their own cost <br>
•        Any passengers testing positive will be required to take a PCR test and isolated awaiting results. If the PCR is positive, passengers will need to isolate for 10 days at Government of Kenya approved isolation facilities at their own cost, with a repeat PCR test on day 7 <br>
•        From 2 December, travellers arriving from or transiting through South Africa, Botswana, Zimbabwe, Malawi, Eswatini, Lesotho, Namibia, Mozambique, Zambia, Malawi, Ghana and Nigeria within the previous 14 days will undergo a free rapid antigen test on arrival for surveillance purposes <br>
All negative COVID-19 test results must prove that they have been taken no more than 72 hours before travel to Kenya and be verified digitally through the <a href=""http://www.globalhaven.org/"">Global Haven website</a>.
*Departing Kenya: From 21 December, all passengers departing Kenya will be required to show a certificate of vaccination against COVID-19, unless they have a certificate of exemption from a medical practitioner. COVID-19 vaccines approved by the World Health Organization (WHO) are considered valid by public health officials in Kenya. You must have received a full dose of a WHO-approved vaccination. Under 18s are exempt from this requirement.
In addition to the above, travellers should be prepared to show compliance with the entry requirements for their transit and destination countries when departing Kenya.
If you will require a negative PCR COVID-19 test to enter your destination or transit country, you should use an <a href=""https://www.kcaa.or.ke/covid-19/approved-pcr-testing-labs"">authorised laboratory</a>. Results should be uploaded to the <a href=""http://www.globalhaven.org/"">Global Haven website</a>.
Travellers who require an antigen test in the hours before their travel, in order to comply with the entry requirements of another country, must undertake this test at the Ministry of Health’s Port Health facility at the airport. Results must be uploaded to the <a href=""http://www.globalhaven.org/"">Global Haven website</a>.
*Data collection: All travellers arriving in Kenya must complete a COVID-19 Travellers Health Surveillance Form before their arrival, even if only transiting. The online registration form can be found on the “Jitenge” platform, accessible via the following <a href=""https://ears.health.go.ke/airline_registration/"">link</a>
 or the “Jitenge” App (available on the Google Play Store). <br>
iPhone users should make sure to use Chrome or Firefox when accessing the form via the URL. Upon submission of the digital locator form, a QR code will be sent to your email address. <br>
For Android users, if you are unable to access the QR code via email, log-in to your Jitenge account and input the phone number used to register, as well as your passport or ID number. Your name will appear, then click on your name and select “Show QR code”. Screenshot the QR code and present this at the Health Desk upon arrival. <br>
For iPhone users unable to access their QR code via email, check your downloads folder or present your phone number and passport number at the Health Desk at arrivals to allow officials to retrieve your QR code.<br>
After submitting the form, travellers will receive a QR code which must be presented to port health officials for them to be allowed to proceed to arrival immigration.<br>
 <br>
 <br>
 Internal Restrictions: <br>
Proof of COVID-19 vaccination required to access transport, state offices, hotels, bars, restaurants (Reuters, 23.12.2021).<br>
*Travel in Kenya: There are currently no restrictions on travel within Kenya. You do not need a COVID-19 negative test to board domestic flights within Kenya. <br>
*Public places and services: Public transport in Kenya is now able to operate at full capacity. <br>
Restaurants and eateries may open to customers, provided they comply with Government of Kenya public health protocols including social distancing. <br>
Bars are permitted to operate until 11pm. <br>
All public and political gatherings are prohibited. <br>
The maximum number of persons permitted to attend weddings and funerals has been capped at 100, with all in attendance expected to abide by Ministry of Health protocols. <br>
Kenyan citizens have been advised to avoid crowded places and to work remotely where possible. <br>
Many shops and restaurants are conducting mandatory temperature checks and will expect customers to use handwashing facilities before entering the premises. <br>
*If you test positive for COVID-19, you may need to stay where you are until you test negative. You may also need to seek treatment there.


","UNHAS
  <a href=""https://www.osac.gov/Content/Report/eb77c55d-fbca-4670-9c2d-18e154a19666/"">OSAC Travel Advisories</a>/ 
  <a href=""https://www.gov.uk/foreign-travel-advice/kenya"">Foreign travel advice, Gov.UK</a>/ 
  <a href=""https://ke.usembassy.gov/covid-19-information/"">US State Dept. COVID-19 Country Specific Information</a>/
 <a href=""https://www.health.go.ke/"">Ministry of Health</a>/"
