20220707,"COVID-19 negative certification required for entering the country.  
To enter Morocco, passengers are required to have had three vaccine doses (or have had their second vaccine dose within the previous four months) , OR proof of a negative PCR test result, with the sample having been taken within 72 hours before boarding. Children under the age of 12 are exempt from these requirements. A single shot of the Johnson & Johnson vaccine counts as two doses. <br>
","Quarantine requirement at government designated site. 

Specific measures will be put in place for positive cases, including isolation at the passengers’ place of residence. More serious cases would be transferred to hospital. <br>
","
For those vaccinated in Morocco, to obtain a Moroccan vaccine pass, you have to have had the vaccine booster if four months have elapsed since your second vaccine dose (or first dose for a single dose vaccine), unless you have proof of previous infection and recovery in the previous four weeks. <br>","Latest News: Government cancels COVID-19 PCR test requirements for all incoming travelers (Reuters, 17.05.2022)
  <br>
  <br>
 International Restrictions:<br>
*Entry and borders: The Moroccan Government re-opened the borders for commercial flights into and out of Morocco on 7 February. <br>
To enter Morocco, passengers are required to have had three vaccine doses (or have had their second vaccine dose within the previous four months) , OR proof of a negative PCR test result, with the sample having been taken within 72 hours before boarding. Children under the age of 12 are exempt from these requirements. A single shot of the Johnson & Johnson vaccine counts as two doses. <br>
Certificates of COVID-19 recovery are not accepted by the Moroccan authorities as an alternative to a negative PCR test result.<br>
For those vaccinated in Morocco, to obtain a Moroccan vaccine pass, you have to have had the vaccine booster if four months have elapsed since your second vaccine dose (or first dose for a single dose vaccine), unless you have proof of previous infection and recovery in the previous four weeks. <br>
All passengers are required to download, print and sign a <a href=""https://www.onda.ma/form.php"">passenger health form</a> before arrival in Morocco. <br>
Random rapid antigen tests will be conducted upon arrival for selected groups of passengers. Additional PCR tests may also be required after 48 hours of arrival for randomly selected passengers. <br>
Specific measures will be put in place for positive cases, including isolation at the passengers’ place of residence. More serious cases would be transferred to hospital. <br>
Moroccan nationals aged 18 and over will require a valid vaccine pass to leave Morocco. <br>
The Moroccan government also re-opened its maritime borders for ferry services on 8 April. The borders with Ceuta and Melilla were re-opened on 17 May. <br>
On 14 April, the Moroccan Transport Minister announced that those travelling to Morocco by ferry would require either a valid vaccination pass or a PCR test, less than 72 hours old. <br>
Travellers transiting through third countries should ensure they consult Travel Advice for that country for the latest COVID-19. <br>
Demonstrating your COVID-19 status: Morocco will accept the proof of COVID-19 vaccination record at the border. Your appointment card from vaccination centres is not designed to be used as proof of vaccination and should not be used to demonstrate your vaccine status. <br>
  <br>
  <br>
Internal Restrictions: <br>
*Travel in Morocco: State of Health Emergency: A state of health emergency has been in place in Morocco since 20 March 2020. Public and private gatherings are permitted up to a maximum of 50 people. Hammams, public swimming pools and sports facilities are permitted to operate at 50% capacity, and restaurants, coffee shops, shops and supermarkets must close at 11pm. <br>
A vaccine pass is required to enter public places including hammams, gyms, cafes, restaurants, hotels, shops and sports halls. A vaccine pass will also be required to access public administration buildings. <br>
People who have received two vaccine shots through Morocco’s national vaccination scheme are able to 
<a href=""http://www.liqahcorona.ma/"">download a vaccine pass</a>, which enables holders to travel within and outside Morocco without restrictions, including during curfew hours. The document contains a QR code, which can be stored in digital format or printed. <br>
Morocco will accept the proof of COVID-19 recovery and vaccination record at the border. If you are travelling with a printed PDF proof of vaccination status, it must date from 1 November to ensure that the certificate can be scanned successfully, if domestic certification is required. Your appointment card from vaccination centres is not designed to be used as proof of vaccination and should not be used to demonstrate your vaccine status. <br>
The wearing of face masks in public spaces remains mandatory. Further local restrictions may be applied by local authorities in cities/prefectures/provinces or in some cases in certain neighbourhoods. Failing to respect the rules can lead to a prison sentence of up to three months or a fine of up to MAD 1300.<br>
*If you test positive for COVID-19, you may need to stay where you are until you test negative. You may also need to seek treatment there.
","<a href=""https://www.gov.uk/foreign-travel-advice/morocco"">Foreign travel advice, Gov.UK</a>/ 
  <a href=""https://www.osac.gov/Content/Report/677054e5-7284-4630-9673-183851a95bd9"">OSAC Travel Advisories</a>/ 
  <a href=""https://ma.usembassy.gov/25161/"">US State Dept. COVID-19 Country Specific Information</a>/
 <a href=""http://sante.gov.ma/"">Ministry of Health</a>/"
