20221115,,,,"Latest News: 
  <br>
International Restrictions: <br>
*All travellers: You should be able to get a visa on arrival if you can prove your vaccination status. <br>
People who have completed COVID-19 vaccination at least 14 days prior to entry to Nepal can get visas on arrival (you should bring proof of vaccination). Non-vaccinated people can also obtain visas on arrival, but – if unvaccinated, and aged over five years old – must be able to show a negative PCR test completed no more than 72 hours before the flight of first departure. Requirements are updated by Nepal’s <a href=""https://www.immigration.gov.np/"">Department of Immigration</a>, sometimes at short notice. <br>
Overstaying your visa in Nepal is a serious crime, and can lead to significant fines or potentially imprisonment. For the latest information on visa fees/fines please check the <a href=""https://www.immigration.gov.np/"">Nepal Immigration website</a>
When flying to Nepal, you will need to present certain documentation:<br>
•        A passport with at least six months’ validity. Those certified vaccinated, can secure a visa on arrival. Those not certified vaccinated must show a negative PCR test, taken no more than 72 hours before the flight of first departure. These requirements do not apply to children aged five or under. <br>
•        a travel insurance document which covers health, immediate crisis, or rescue for the duration of your travel <br>
•        a barcode generated from the online application of the Online International Travel Arrival Form. See <a href=""https://www.ccmc.gov.np/"">ARMS-DIMS</a>
• You should also be ready to show evidence of your initial hotel booking. <br>
If you are symptomatic on arrival, you may be subject to testing; If you test positive, you will be required to quarantine in Government-provided facilities at your own expense. <br>
Requirements can change at short notice, so check with your carrier and/or look for official notices to make sure you are complying with entry requirements-.see the Department of Immigration’s <a href=""https://www.immigration.gov.np/"">main site</a>.
The authorities now require your carrier to inform you of PCR requirements for flights to depart Nepal, too. You should check with your carrier before flying, and make appropriate arrangements. You should arrange to take a private test. <br>
Proof of vaccination status: Nepal will accept the proof of COVID-19 recovery and vaccination record. Your appointment card from vaccination centres is not designed to be used as proof of vaccination and should not be used to demonstrate your vaccine status. <br>
If you’re not fully vaccinated: The Government of Nepal defines people who are fully vaccinated as those who have received full doses of an approved vaccine more than 14 days previously. If you’re not fully vaccinated, you must obtain a negative PCR test not more than 72 hours before your flight of first departure to enter Nepal, and should then be able to obtain a visa on arrival. <br>
Unvaccinated people, or those unable to show that they have been fully vaccinated for at least fourteen days, may also subject be free antigen tests on arrival. This applies to all passengers aged over five years old. <br>
Requirements can change at short notice, so check with your carrier and/or look for official notices to make sure you are complying with entry requirements – see the Department of Immigration’s <a href=""https://www.immigration.gov.np/"">main site</a>
Children and young people: Children aged 5 years and under do not require to be vaccinated or tested when arriving to Nepal. Unvaccinated older children are subject the same health protocols as adults. <br>
If you’re transiting through Nepal: If you are transiting through Nepal on your way to another country and staying in the airport (airside) you will need: <br>
•        if unvaccinated, a certificate showing a negative Reverse Transcription Polymerase Chain Reaction (RT-PCR) test, taken within 72 hours of flight of first departure <br>
•        a visa or prior approval document. <br>
•        a travel insurance document which covers health, immediate crisis, or rescue for the duration of your travel <br>
•        a barcode generated from the online application of the Online International Travel Arrival Form. See ARMS-DIMS <br>
Exemptions: The Department of Immigration has provided fuller information on their notice on their main site. <br>
 <br>
<br>
 Internal Restrictions: <br>
*Travel in Nepal: The Nepali authorities have imposed temporary restrictions to control the COVID-19 outbreak. Some restrictions to non-essential services may be introduced or extended at short notice. You must wear face masks to access essential services (including access to medical care, to shop, and to access the airport for outbound flights), and adults are also required to carry and show proof of vaccination. There are penalties for people who do not observe these rules. <br>
*Accommodation: Although most hotels in the Kathmandu valley are open, this can change at short notice. Local administrations in other districts are free to adapt a different model, and more restrictive lockdowns are still in place in other parts of the country.
•        public spaces and services are now currently operating a restricted service in the Kathmandu valley to control outbreaks of COVID-19, and other districts may operate more restrictive models. Shops and services when open will only serve customers wearing some form of face mask. Shop openings may vary by location, as local administrations in other districts are free to adapt a different model <br>
•        people are required to maintain social distancing and wear masks in public <br>
•        there are current limitations on the opening of entertainment centres such as cinema halls and dance bars, health clubs and swimming clubs, salons, beauty parlours, spas, libraries, zoos, and museums. You will need to wear masks, and adults will need to show proof of vaccination status <br>
There have been reports of some incidents in parts of Nepal of foreign tourists being threatened or intimidated by locals, allegedly in relation to coronavirus. Such incidents are rare. <br>
*If you test positive for COVID-19, you may need to stay where you are until you test negative. You may also need to seek treatment there.



","<a href=""https://www.osac.gov/Content/Browse/Report?subContentTypes=Alerts%2CTravel%20Advisories"">OSAC Travel Advisories</a>/ 
  <a href=""https://www.gov.uk/foreign-travel-advice/nepal/staying-during-coronavirus"">Foreign travel advice, Gov.UK</a>/ 
  <a href=""https://np.usembassy.gov/covid-19-information/"">US State Dept. COVID-19 Country Specific Information</a>/"
