20220203,"COVID-19 negative certification required for entering the country.  
     
All travellers aged 12 years and older – regardless of vaccination status – are also required to show a negative COVID-19 test result (RT-PCR, LAMP or NAAT) taken no more than 48 hours prior to travel, or a negative antigen test taken up to 24 hours before travel.<br>
Travellers aged 12 years and older who have tested positive for COVID-19 between 14 and 90 days prior to entering the country are exempt from the requirement to provide a pre-departure test, however they must prove this situation with documentation from their health care provider and laboratory results showing positive antigens.<br>
Paraguayan nationals and foreign nationals resident in a MERCOSUR party state or associate country are exempt of the requirement to show evidence of international health insurance with COVID-19 coverage.","Quarantine requirement at government designated site. 
All travellers who are permitted to enter Paraguay but do not have proof of vaccination must enter preventative isolation for ten days upon their arrival, at a hotel or residence of their choosing.<br>
All travellers must present evidence of international health insurance, that includes COVID-19 coverage and undertake a COVID-19 PCR test on the 5th day after the pre-travel test – if still in Paraguay at that date. If the test comes back positive, the traveller will have to isolate for 7 days. Children aged 11 years and younger are exempt from presenting the traveller’s health declaration form, proof of vaccination and the 5th day after the pre-travel test.<br>","Fully vaccinated travellers can enter Paraguay. Travellers aged 18 years and older must be able to prove their full vaccination status by presenting evidence of a full vaccination scheme. Travellers aged 17 years and under are exempt from presenting proof of vaccination. Only travellers who have completed 2 weeks since their final dose are considered fully vaccinated. Paraguay recognises as final the second dose in a two-dose vaccination scheme, or a single dose in a single-dose vaccination scheme.<br>","Latest News: 
  <br>
  <br>
 International Restrictions:<br>
 *If you’re fully vaccinated: Fully vaccinated travellers can enter Paraguay. Travellers aged 18 years and older must be able to prove their full vaccination status by presenting evidence of a full vaccination scheme. Travellers aged 17 years and under are exempt from presenting proof of vaccination. <br>
Only travellers who have completed 2 weeks since their final dose are considered fully vaccinated. Paraguay recognises as final the second dose in a two-dose vaccination scheme, or a single dose in a single-dose vaccination scheme. <br>
Before travelling to Paraguay, all travellers aged 12 years and older – regardless of vaccination status – are required to complete an online <a href=""http://dgvs.mspbs.gov.py/webdgvs/views/paginas/vista_viajeros_nor.html"">Traveller’s Health Declaration Form</a>, up to 24 hours prior to entering the country. After completion, a QR code will be generated, which should be saved and presented upon request, for example to the airline at check-in and to the Paraguayan authorities upon arrival. <br>
All travellers aged 12 years and older – regardless of vaccination status – are also required to show a negative COVID-19 test result (RT-PCR, LAMP or NAAT) taken no more than 48 hours prior to travel, or a negative antigen test taken up to 24 hours before travel. <br>
All travellers must present evidence of international health insurance, that includes COVID-19 coverage and undertake a COVID-19 PCR test on the 5th day after the pre-travel test – if still in Paraguay at that date. If the test comes back positive, the traveller will have to isolate for 7 days. <br>
Children aged 11 years and younger are exempt from presenting the traveller’s health declaration form, proof of vaccination and the 5th day after the pre-travel test. Travellers aged 12 years and older who have tested positive for COVID-19 between 14 and 90 days prior to entering the country are exempt from the requirement to provide a pre-departure test, however they must prove this situation with documentation from their health care provider and laboratory results showing positive antigens.  All travellers - regardless of vaccination status - are required to wear a facemask covering mouth, nose and chin.  <br>
Entry to Paraguay upon arrival may be refused for not adhering to these requirements.
For further information on entry requirements, you can visit <a href=""https://www.mspbs.gov.py/portal/24663/paraguay-actualiza-exigencias-sanitarias-de-ingreso-al-pais.html"">Paraguay’s Health Ministry website</a> (in Spanish).
*Proof of vaccination status: You must present proof that you have been fully vaccinated to enter Paraguay. <br>
Paraguay will accept the proof of COVID-19 recovery and vaccination record and proof of COVID-19 vaccination issued in the Crown Dependencies. Your second dose must have been administered at least 14 days prior to travel. Your appointment card from vaccination centres is not designed to be used as proof of vaccination and should not be used to demonstrate your vaccine status. <br>
*If you’re not fully vaccinated: Travellers who do not have a full vaccination scheme may be refused entry and deported unless they fall into specific categories listed below, which are subject to special provisions. <br>
Travellers who do not have proof of vaccination due to a health condition must document this with a medical report. This should be shared with the Paraguayan authorities via email to <a href=""viajerosbase@gmail.com"">viajerosbase@gmail.com</a> and wait for a response before travel. <br>
Travellers who do not have proof of vaccination due to humanitarian reasons must send an email to <a href=""viajerosbase@gmail.com"">viajerosbase@gmail.com  </a> and await a response before travel. In the email, the traveller must state their reasons to request entry and wait for a response before their travel.
Travellers should be aware that <a href=""viajerosbase@gmail.com"">viajerosbase@gmail.com</a> intends to respond within 48 hours but delays may occur.
All travellers who are permitted to enter Paraguay but do not have proof of vaccination must enter preventative isolation for ten days upon their arrival, at a hotel or residence of their choosing.
They must also take a COVID-19 PCR test on the 5th day of isolation. Should the test result be negative, they end isolation. Should the test result be positive, they must isolate for five more days and send their test results to <a href=""viajerosbase@gmail.com"">viajerosbase@gmail.com</a>.
*Children and young people: Children aged 17 years and under are exempt from presenting proof of vaccination but not from presenting the traveller’s health declaration form, pre-departure test and the 5th day after the pre-travel test. <br>
Children aged 11 years and younger are exempt from presenting the traveller’s health declaration form, pre-departure test, proof of vaccination and the 5th day after the pre-travel test.
*Exceptions: Paraguayan nationals and foreign nationals resident in a MERCOSUR party state or associate country are exempt of the requirement to show evidence of international health insurance with COVID-19 coverage. <br>
Travellers coming from MERCOSUR party states or from states that share a border with Paraguay as the origin of travel are exempt from the requirement to present a negative PCR or antigen COVID-19 test before travel. <br>
Travellers coming from MERCOSUR party states or from states that share a border with Paraguay as the origin of travel are also exempt from taking a COVID-19 PCR test on the 5th day after the pre-travel test, unless they present symptoms. If they present symptoms during their stay, the traveller must get an RT-PCR test, submit the result to <a href=""viajerosbase@gmail.com"">viajerosbase@gmail.com</a>, and isolate for ten days. <br>
Land transit in border regions for commercial reasons is allowed for up to 72 hours and up to 30 km without any of the aforementioned requirements for those who can show proof of residency in a border city.<br>
  <br>
  <br>
Internal Restrictions: <br>
*Travel in Paraguay: In March 2020, Paraguayan authorities declared a nationwide health-related State of Emergency, putting in place restrictions, which were relaxed in phases. <br>
Local authorities have reduced the nationwide restriction on free movement between 2am and 5am. Between these hours, there are exceptions to go to the pharmacy or hospital, and for essential workers. <br>
Wearing a facemask is mandatory at all times and observing sanitary measures (washing of hands and observing physical distance). <br>
*Accommodation: Some accommodation options are open such as hotels, hostels and private rentals. Check with your accommodation provider what facilities, including restaurants, are available. <br>
*Public spaces and services:<br>
Commercial activities: <br>
•        businesses can operate in well-ventilated environments between the permitted hours, with use of facemasks, work in crews to limit contact and promoting the sale of products on a delivery and pickup basis <br>
•        restaurants can operate within the permitted hours, promoting delivery and pickup services or on a reservation and client registration <br>
•        essential businesses such as pharmacies, delivery services and call centres can operate on a 24 hour basis <br>
*Academic activities: in-classroom lessons can take place, subject to compliance with the Ministry of Education’ operational guide and observing the maximum number of individuals of the bubble groups according to the physical space available, having to guarantee in all in person classes the physical distance of 1.5m <br>
*Social activities: Social events in public and private venues are allowed for up to 200 people in closed spaces with adequate ventilation and up to 350 people in outdoor spaces and a person responsible for the event, with prior individual registration, mandatory use of facemasks and observing all sanitary measures. Bars and dancefloors are allowed only in outdoor spaces. Outdoor and closed spaces cannot be combined <br>
•        social events in private homes can take place with up to 15 people <br>
*Physical activities: physical activities, non-contact sports and group classes are allowed in academies, gyms and other sport related spaces, based on a reservation, registration of client details and observing a 4m social distancing <br>
•        children can take part in recreational and physical activities in outdoor spaces <br>
*Cultural and religious activities: cultural activities and religious services can take place with the presence of up 50% of the venue’s capacity, observing a 1.5m social distancing, mandatory use of facemasks, with preassigned seating, previous registration and in compliance with sanitary measures. <br>
*Further information: For exhaustive information, visit the <a href=""https://www.mspbs.gov.py/cuarentena-inteligente.html"">Paraguayan Ministry of Health website</a> (in Spanish). <br>
The Paraguayan government has announced that, if the circumstances require it, further localised restrictions may be put into place. You should follow local government guidelines stated on the <a href=""https://www.mspbs.gov.py/covid-19.php"">Paraguayan Ministry of Health website</a> (in Spanish).<br>
*If you test positive for COVID-19, you may need to stay where you are until you test negative. You may also need to seek treatment there.","<a href=""https://www.osac.gov/Content/Report/c8fbf3b3-a39d-489a-b9a2-185718411a21"">OSAC Travel Advisories</a>/ 
  <a href=""https://py.usembassy.gov/covid-19-information/"">US State Dept. COVID-19 Country Specific Information</a>/ 
  <a href=""https://www.gov.uk/foreign-travel-advice"">Foreign travel advice, Gov.UK</a>/
 <a href=""https://www.mspbs.gov.py/covid-19.php"">Covid19 Country Link</a>/"
