20210413,"COVID-19 negative certification required for entering the country

Visitors will be required to present a negative PCR test taken within 72 hours prior to departure and must stay at approved accommodation. All passengers will be temperature checked at all ports of arrival. If symptoms of COVID-19 are found to be present, tests will be conducted. Those found to be positive will be quarantined and re-checked.","Quarantine requirement at government designated site.

Visitors must stay at approved accommodation, and provide both an authentic vaccination certificate (at least two weeks prior to travel) and a negative PCR test result conducted within 72 hours of travel. Visitors who met this requirement will not be required to quarantine on arrival.
<br>
Seychellois, residents, and Gainful Occupational Permit holders, who have received a complete course of a COVID-19 vaccine (including a second dose where required), may enter Seychelles from any country and will not face quarantine. Unvaccinated Seychellois and permanent residents must undergo 7 days of home quarantine.","<a href=""https://www.gov.uk/foreign-travel-advice/seychelles/entry-requirements"">Foreign travel advice, Gov.UK</a>/ 
  <a href=""https://mu.usembassy.gov/covid-19-seychelles/"">US State Dept. COVID-19 Country Specific Information</a>/ 
  <a href=""https://www.osac.gov/Content/Browse/Report?subContentTypes=Alerts%2CTravel%20Advisories"">OSAC Travel Advisories</a>/
  <a href=""http://www.health.gov.sc/"">Ministry of Health</a>/","Latest News: Several airlines resume Seychelles routes (Simple Flying, 08.03.2021). Borders will reopen for tourists from 25 March; travelers from South Africa not included (Reuters, 04.03.2021). 
  <br>
  <br>
 International Restrictions: <br>
*Entry rules in response to coronavirus (COVID-19): 
From 25 March 2021, Seychelles will open to all visitors irrespective of their vaccination status. This temporarily excludes visitors travelling from South Africa, who are not permitted to enter Seychelles until further notice. Visitors from all other countries will be required to present a negative PCR test taken within 72 hours prior to departure and must stay at approved accommodation. There will be no quarantine requirement and no restriction on movement for visitors upon entry to Seychelles. Visitors must adhere to public health measures. If you plan to travel to Seychelles, you must do so in accordance with current UK COVID-19 restrictions and should familiarise yourself with the travel advisory at the <a href=""http://tourism.gov.sc/2021/01/22/travel-advisory-for-visitors-from-permitted-countries/"">Ministry for Foreign Affairs and Tourism website</a> and the ‘conditions for entry’ section of the <a href=""http://www.health.gov.sc/"">Ministry of Health website</a>, which outline all requirements for entry and pre-travel conditions which must be met.<br>
An application for entry form should also be completed and returned to the Public Health Authority before travel. Work permit holders must also be cleared by the Department of Employment and Immigration. If you’re uncertain of your status, you should contact the Department of Employment and Immigration before attempting to enter Seychelles.<br>
You can find a travel advisory detailing the full entry procedures for all travellers at the <a href=""http://tourism.gov.sc/2021/01/22/travel-advisory-for-visitors-from-permitted-countries/"">Ministry for Foreign Affairs and Tourism website</a> and ‘conditions for entry’ at the <a href=""http://www.health.gov.sc/"">Ministry of Health website</a>. You’re strongly advised to familiarise yourself with the full entry requirements before you travel. These may be updated regularly and without warning. <br>
A Health Travel Authorisation is required for travellers entering Seychelles by sea. Travellers arriving by sea who have spent at least 14 days at sea since their last port of call do not require a PCR test. Clients or crew who wish to disembark before completion of 14 days since their last port of call must have proof of vaccination and undertake a PCR test on arrival. If you are travelling by sea, you should follow the guidelines on the ‘conditions for entry’ at the <a href=""http://www.health.gov.sc/"">Ministry of Health website</a>.<br>
Cruise ships from any country worldwide will not be permitted to berth in Seychelles until further notice.<br>
*Screening on arrival: All passengers will be temperature checked at all ports of arrival. If symptoms of COVID-19 are found to be present, tests will be conducted. Those found to be positive will be quarantined and re-checked.<br>
*Quarantine requirements: Seychellois and permanent residents may enter Seychelles from any country and will not face quarantine if they have completed a full dose of vaccination at least two weeks before travelling. Unvaccinated Seychellois and permanent residents must undergo 7 days of home quarantine.<br>
Gainful Occupational Permit (GOP) holders may enter Seychelles from any country and will not face quarantine if they have completed a full dose of vaccination at least two weeks before travelling. All unvaccinated GOP holders travelling to Seychelles will be expected to undergo 7 days of quarantine in a private quarantine facility or a certified tourism establishment.<br>
If you intend to travel to Seychelles, you should familiarise yourself with the ‘conditions for entry’ section of the <a href="""">Ministry for Health website</a>.<br>
  <br>
  <br> 
Internal Restrictions: <br>
*Travel in Seychelles: The Government of Seychelles has extended COVID-19 restrictions across the country until further notice.
If you’re living in Seychelles or intend to travel to Seychelles, you’re strongly advised to familiarise yourself with these measures and to follow public health guidelines. The Ministry of Health in Seychelles has issued a list of new and additional measures on the <a href=""http://www.health.gov.sc/index.php/2021/01/04/new-measures-effected-as-covid-19-cases-rise/"">Ministry of Health website</a>. You should avoid travelling unnecessarily within the country, including between islands.<br>
You should wear a mask and observe social distancing at all times when in public.<br>
*Accommodation: Some hotels are open across Seychelles. If you have made a booking, you should make contact with your tour operator or hotel proprietor before travelling to Seychelles.<br> 
* Public spaces and services: The Government of Seychelles has introduced new restrictions on the use of public spaces and services, following an increase in the number of coronavirus cases in Seychelles. A full list of the new measures can be found at the <a href=""http://www.health.gov.sc/index.php/2021/01/04/new-measures-effected-as-covid-19-cases-rise/"">Ministry of Health website</a>. These measures will remain in place until further notice.<br>
A nationwide curfew is in place from 11pm to 4am. You should not travel outside your accommodation between these times without authorisation. Restrictions on movement are reviewed regularly. House parties are not permitted.
Restrictions are enforceable by law and can change at short notice. You should consult the Ministry of Health in Seychelles for further information and monitor local media for the latest developments."
